,action
310,"As Harry Potter begins his sixth year at Hogwarts, he discovers an old book marked as ""the property of the Half-Blood Prince"" and begins to learn more about Lord Voldemort's dark past."
311,"Jedi Master Obi-Wan Kenobi must save young Leia after she is kidnapped, all the while being pursued by Imperial Inquisitors and his former Padawan now known as Darth Vader."
312,"Four years after the destruction of Isla Nublar, Biosyn operatives attempt to track down Maisie Lockwood, while Dr Ellie Sattler investigates a genetically engineered swarm of giant insects."
313,"In the riveting conclusion of the landmark Skywalker saga, new legends will be born-and the final battle for freedom is yet to come."
314,The Avengers and their allies must be willing to sacrifice all in an attempt to defeat the powerful Thanos before his blitz of devastation and ruin puts an end to the universe.
315,"An update to the 1996 film 'Twister', which centered on a pair of storm chasers who risk their lives in an attempt to test an experimental weather alert system."
316,"A century before Captain Kirk's five-year mission, Jonathan Archer captains the United Earth ship Enterprise during the early years of Starfleet, leading up to the Earth-Romulan War and the formation of the Federation."
317,"For his final assignment, a top temporal agent must pursue the one criminal that has eluded him throughout time. The chase turns into a unique, surprising and mind-bending exploration of love, fate, identity and time travel taboos."
318,"Naruto Uzumaki, is a loud, hyperactive, adolescent ninja who constantly searches for approval and recognition, as well as to become Hokage, who is acknowledged as the leader and strongest of all ninja in the village."
319,A young German soldier's terrifying experiences and distress on the western front during World War I.
320,"It follows Li Xin and Wang Qi as they stand on the battlefield for the first time to fight off an invasion by Zhao, and it also follows Ying Zheng's unknown past."
321,"The missions of MI-5, the UK's domestic intelligence organization."
322,"While trying to lead a quiet suburban life, a family of undercover superheroes are forced into action to save the world."
323,"The youngest son of an alcoholic former boxer returns home, where he's trained by his father for competition in a mixed martial arts tournament - a path that puts the fighter on a collision course with his estranged, older brother."
324,"A superhero-admiring boy enrolls in a prestigious hero academy and learns what it really means to be a hero, after the strongest superhero grants him his own powers."
325,The Dark Knight battles crime in Gotham City with occasional help from Robin and Batgirl.
326,"Determined to ensure that Superman's ultimate sacrifice wasn't in vain, Bruce Wayne recruits a team of metahumans to protect the world from an approaching threat of catastrophic proportions."
327,"In Jumanji: The Next Level, the gang is back but the game has changed. As they return to rescue one of their own, the players will have to brave parts unknown from arid deserts to snowy mountains, to escape the world's most dangerous game."
328,"Two criminals and their hostages unknowingly seek temporary refuge in a truck stop populated by vampires, with chaotic results."
329,"Sees the foul-mouthed, chirp-serving, mother-loving, fan favorite character, Shoresy, join a senior AAA hockey team in Sudbury on a quest to never lose again."
330,Katniss and a team of rebels from District 13 prepare for the final battle that will decide the fate of Panem.
331,"Lara Croft, the fiercely independent daughter of a missing adventurer, must push herself beyond her limits when she discovers the island where her father, Lord Richard Croft disappeared."
332,"In a time of conflict, a group of unlikely heroes band together on a mission to steal the plans to the Death Star, the Empire's ultimate weapon of destruction."
333,A police officer joins a secret organization that polices and monitors extraterrestrial interactions on Earth.
334,"Charlie Swift is a fixer with a problem: the thug he's whacked is missing his head and Charlie will only be paid if the body can be identified. Enter Marcie Kramer, the victim's ex-wife and a woman with all the skills Charlie needs."
335,An ex-UFC middleweight fighter ends up working at a rowdy bar in the Florida Keys where things are not as they seem.
336,"Doctor Strange teams up with a mysterious teenage girl from his dreams who can travel across multiverses, to battle multiple threats, including other-universe versions of himself, which threaten to wipe out millions across the multiverse. They seek help from Wanda the Scarlet Witch, Wong and others."
337,"In 2027, in a chaotic world in which women have somehow become infertile, a former activist agrees to help transport a miraculously pregnant woman to a sanctuary at sea."
338,"An ancient Egyptian princess is awakened from her crypt beneath the desert, bringing with her malevolence grown over millennia and terrors that defy human comprehension."
339,Lawman Luke Hobbs and outcast Deckard Shaw form an unlikely alliance when a cyber-genetically enhanced villain threatens the future of humanity.
340,"April 6th, 1917. As an infantry battalion assembles to wage war deep in enemy territory, two soldiers are assigned to race against time and deliver a message that will stop 1,600 men from walking straight into a deadly trap."
341,"An ancient struggle between two Cybertronian races, the heroic Autobots and the evil Decepticons, comes to Earth, with a clue to the ultimate power held by a teenager."
342,Los Angeles police officer Brian O'Conner must decide where his loyalty really lies when he becomes enamored with the street racing world he has been sent undercover to destroy.
343,Baltimore. New Year's Eve. A talented but troubled police officer (Shailene Woodley) is recruited by the FBI's chief investigator (Ben Mendelsohn) to help profile and track down a disturbed individual terrorizing the city.
344,"The vampire Angel, cursed with a soul, moves to Los Angeles and aids people with supernatural-related problems while questing for his own redemption."
345,"In Mexico City, a former CIA operative swears vengeance on those who committed an unspeakable act against the family he was hired to protect."
346,"After being held captive in an Afghan cave, billionaire engineer Tony Stark creates a unique weaponized suit of armor to fight evil."
347,"A spaceship arrives in 1873 Arizona to take over the Earth, starting with the Wild West region. All that stands in their way: a posse of cowboys and natives."
348,"In 1938, after his father goes missing while pursuing the Holy Grail, Indiana Jones finds himself up against the Nazis again to stop them from obtaining its powers."
349,"Peter Parker balances his life as an ordinary high school student in Queens with his superhero alter-ego Spider-Man, and finds himself on the trail of a new menace prowling the skies of New York City."
350,"In a future British dystopian society, a shadowy freedom fighter, known only by the alias of ""V"", plots to overthrow the tyrannical government - with the help of a young woman."
351,"The defiant leader Moses rises up against Egyptian Pharaoh Ramses II, setting six hundred thousand slaves on a monumental journey of escape from Egypt and its terrifying cycle of deadly plagues."
352,"After an Alaskan town is plunged into darkness for a month, it is attacked by a bloodthirsty gang of vampires."
353,"Seven years after the world has become a frozen wasteland, the remnants of humanity inhabit a perpetually-moving train that circles the globe, where class warfare, social injustice and the politics of survival play out."
354,"In a dystopian America, a falsely convicted policeman gets his shot at freedom when he must forcibly participate in a TV game show where convicts, runners, must battle killers for their freedom."
355,"In a world where mutants (evolved super-powered humans) exist and are discriminated against, two groups form for an inevitable clash: the supremacist Brotherhood, and the pacifist X-Men."
356,Earth's mightiest heroes must come together and learn to fight as a team if they are going to stop the mischievous Loki and his alien army from enslaving humanity.
357,"After saving the realm from evil and destruction at the hands of the most terrifying power couple in Exandria, Vox Machina is faced with saving the world once again-this time, from a sinister group of dragons known as the Chroma Conclave."
358,"After earning 00 status and a licence to kill, secret agent James Bond sets out on his first mission as 007. Bond must defeat a private banker funding terrorists in a high-stakes game of poker at Casino Royale, Montenegro."
359,A man brutally murdered comes back to life as an undead avenger of his and his fiancée's murder.
360,A freewheeling Detroit cop pursuing a murder investigation finds himself dealing with the very different culture of Beverly Hills.
361,"D'Artagnan arrives in Paris trying to find his attackers after being left for dead, which leads him to a real war where the future of France is at stake. He aligns himself with Athos, Porthos and Aramis, three musketeers of the King."
362,"In a future where mutants are nearly extinct, an elderly and weary Logan leads a quiet life. But when Laura, a mutant child pursued by scientists, comes to him for help, he must get her to safety."
363,"When the manic Dr. Robotnik returns to Earth with a new ally, Knuckles the Echidna, Sonic and his new friend Tails is all that stands in their way."
364,"The world's most famous superhero and comic books' most famous journalist face the pressures and complexities that come with balancing work, justice, and parenthood in today's society."
365,"Return to a world of two realities: one, everyday life; the other, what lies behind it. To find out if his reality is a construct, to truly know himself, Mr. Anderson will have to choose to follow the white rabbit once more."
366,"A new theme park, built on the original site of Jurassic Park, creates a genetically modified hybrid dinosaur, the Indominus Rex, which escapes containment and goes on a killing spree."
367,"Naruto Uzumaki, a mischievous adolescent ninja, struggles as he searches for recognition and dreams of becoming the Hokage, the village's leader and strongest ninja."
368,Former United Nations employee Gerry Lane traverses the world in a race against time to stop a zombie pandemic that is toppling armies and governments and threatens to destroy humanity itself.
369,"Steve Rogers, a rejected military soldier, transforms into Captain America after taking a dose of a ""Super-Soldier serum"". But being Captain America comes at a price as he attempts to take down a warmonger and a terrorist organization."
370,"In 1935, Indiana Jones is tasked by Indian villagers with reclaiming a rock stolen from them by a secret cult beneath the catacombs of an ancient palace."
371,A desk-bound CIA analyst volunteers to go undercover to infiltrate the world of a deadly arms dealer and prevent diabolical global disaster.
372,The brash James T. Kirk tries to live up to his father's legacy with Mr. Spock keeping him in check as a vengeful Romulan from the future creates black holes to destroy the Federation one planet at a time.
373,"Walt Longmire is the dedicated and unflappable sheriff of Absaroka County, Wyoming. Widowed only a year, he is a man in psychic repair but buries his pain behind his brave face, unassuming grin and dry wit."
374,"A group of Iraq War veterans look to clear their name with the U.S. Military, who suspect the four men of committing a crime for which they were framed."
375,A cold and mysterious character working at a cash truck company responsible for moving a lot of money around Los Angeles each week.
376,"Humans in a fascist, militaristic future wage war with giant alien bugs."
377,"After leaving off from Spider-Man: Across the Spider-Verse, the story continues."
378,The adventures of an idealistic mad scientist and his field team of superpowered outcasts.
379,"Obsessed gamer Arisu suddenly finds himself in a strange, emptied-out version of Tokyo in which he and his friends must compete in dangerous games in order to survive."
380,Tells the story of London being torn apart by the turbulent power struggles of its international gangs and the sudden power vacuum that's created when the head of London's most powerful crime family is assassinated.
381,Carol Danvers becomes one of the universe's most powerful heroes when Earth is caught in the middle of a galactic war between two alien races.
382,"On a journey to find the cure for a Tatarigami's curse, Ashitaka finds himself in the middle of a war between the forest gods and Tatara, a mining colony. In this quest he also meets San, the Mononoke Hime."
383,Dom and the crew must take on an international terrorist who turns out to be Dom and Mia's estranged brother.
384,"Erin Carter, a British teacher in Spain, finds herself caught up in a supermarket robbery. When one of the robbers claims to recognize her, her life threatens to unravel."
385,"T'Challa, heir to the hidden but advanced kingdom of Wakanda, must step forward to lead his people into a new future and must confront a challenger from his country's past."
386,"Four teenagers are sucked into a magical video game, and the only way they can escape is to work together to finish the game."
387,"As the Mayan kingdom faces its decline, a young man is taken on a perilous journey to a world ruled by fear and oppression."
388,"Cordell Walker and his partner, James Trivette, are Texas Rangers. They make it their business to battle crime in Dallas and all around the state of Texas."
389,Captain Jack Sparrow is pursued by old rival Captain Salazar and a crew of deadly ghosts who have escaped from the Devil's Triangle. They're determined to kill every pirate at sea...notably Jack.
390,"Ethan Hunt and his IMF team, along with some familiar allies, race against time after a mission gone wrong."
391,"In the early years of the 20th century, the Kingsman agency is formed to stand against a cabal plotting a war to wipe out millions."
392,A teenager becomes a major competitor in the world of drift racing after moving in with his father in Tokyo to avoid a jail sentence in America.
393,"Set in a future where consciousness is digitized and stored, a prisoner returns to life in a new body and must solve a mind-bending murder to win his freedom."
394,A pair of underachieving cops are sent back to a local high school to blend in and bring down a synthetic drug ring.
395,"An alien orphan is sent from his dying planet to Earth, where he grows up to become his adoptive home's first and greatest superhero."
396,"King Louis XIV's quest for immortality leads him to capture and steal a mermaid's life force, a move that is further complicated by his illegitimate daughter's discovery of the creature."
397,"Scott Lang and Hope Van Dyne are dragged into the Quantum Realm, along with Hope's parents and Scott's daughter Cassie. Together they must find a way to escape, but what secrets is Hope's mother hiding? And who is the mysterious Kang?"
398,The son of a virtual world designer goes looking for his father and ends up inside the digital world that his father designed. He meets his father's corrupted creation and a unique ally who was born inside the digital world.
399,"Katniss Everdeen is in District 13 after she shatters the games forever. Under the leadership of President Coin and the advice of her trusted friends, Katniss spreads her wings as she fights to save Peeta and a nation moved by her courage."
400,"It follows a British secret agent who takes up the job of solving a dark mystery. He is led into a web of love, deceit and betrayal. His success and failure can change the course of history."
401,"Josh Futturman, a janitor by day and a gamer by night, is recruited by mysterious visitors to travel through time to prevent the extinction of humanity."
402,A football player and his friends travel to the planet Mongo and find themselves fighting the tyranny of Ming the Merciless to save Earth.
403,"A spy on an undercover mission gets married and adopts a child as part of his cover. His wife and daughter have secrets of their own, and all three must strive to keep together."
404,Newly-paroled ex-con and former U.S. Ranger Cameron Poe finds himself trapped in a prisoner-transport plane when the passengers seize control.
405,"In the 1980s the X-Men must defeat an ancient all-powerful mutant, En Sabah Nur, who intends to thrive through bringing destruction to the world."
406,"An immortal Scottish swordsman must confront the last of his immortal opponents, a murderously brutal barbarian who lusts for the fabled ""Prize""."
407,Fury and Talos try to stop the Skrulls who have infiltrated the highest spheres of the Marvel Universe.
408,Two victims of traumatized childhoods become lovers and psychopathic serial murderers irresponsibly glorified by the mass media.
409,The X-Men send Wolverine to the past in a desperate effort to change history and prevent an event that results in doom for both humans and mutants.
410,Plot under wraps
411,"When a man goes in to have virtual vacation memories of the planet Mars implanted in his mind, an unexpected and harrowing series of events forces him to go to the planet for real - or is he?"
412,"Members of the public are pitted against superfit Gladiators in trials of strength, speed and stamina."
413,Follows a lawyer at the CIA who gets entangled in dangerous international power politics when a former asset threatens to expose the nature of her long-term relationship with the agency.
414,Elite agents of the FBI's International division travel the world with the mission of protecting Americans wherever they may be.
415,"Two mismatched New York City detectives seize an opportunity to step up like the city's top cops, whom they idolize, only things don't quite go as planned."
416,"Follows the titular superhero as he reconciles his heritage with his human upbringing. He is the embodiment of truth, justice and a brighter tomorrow in a world that views kindness as old-fashioned."
417,"In a future where people stop aging at 25, but are engineered to live only one more year, having the means to buy your way out of the situation is a shot at immortal youth. Here, Will Salas finds himself accused of murder and on the run with a hostage - a connection that becomes an important part of the way against the system."
418,"As a new threat to the galaxy rises, Rey, a desert scavenger, and Finn, an ex-stormtrooper, must join Han Solo and Chewbacca to search for the one hope of restoring peace."
419,The adventures of Superman's cousin and her own superhero career.
420,"Picking up where The Suicide Squad (2021) left off, Peacemaker returns home after recovering from his encounter with Bloodsport - only to discover that his freedom comes at a price."
421,"While a zombie virus breaks out in South Korea, passengers struggle to survive on the train from Seoul to Busan."
422,"The Bride continues her quest of vengeance against her former boss and lover Bill, the reclusive bouncer Budd, and the treacherous, one-eyed Elle."
423,"When a pilot crashes and tells of conflict in the outside world, Diana, an Amazonian warrior in training, leaves home to fight a war, discovering her full powers and true destiny."
424,A fictitious story about two legendary revolutionaries and their journey away from home before they started fighting for their country in the 1920s.
425,"Thomas is deposited in a community of boys after his memory is erased, soon learning they're all trapped in a maze that will require him to join forces with fellow ""runners"" for a shot at escape."
426,"After his master dies, a peasant squire, fueled by his desire for food and glory, creates a new identity for himself as a knight."
427,"Fueled by his restored faith in humanity and inspired by Superman's selfless act, Bruce Wayne enlists the help of his new-found ally, Diana Prince, to face an even greater enemy."
428,"Jamie regrets her breakup with her girlfriend, while Marian needs to relax. In search of a fresh start, they embark on an unexpected road trip to Tallahassee, but things quickly go awry when they cross paths with a group of inept criminals."
429,An alien child is evacuated from his dying world and sent to Earth to live among humans. His peace is threatened when other survivors of his home planet invade Earth.
430,A pilot finds himself caught in a war zone after he's forced to land his commercial aircraft during a terrible storm.
431,"In a self-destructing world, a vengeful Australian policeman sets out to stop a violent motorcycle gang."
432,"High school student Ichigo Kurosaki, who has the ability to see ghosts, gains soul reaper powers from Rukia Kuchiki and sets out to save the world from ""Hollows""."
433,"To avoid prison, a gang of notorious animal criminals pretends to seek being rehabilitated, only for their leader to realize that he genuinely wants to change his ways."
434,"An American agent, under false suspicion of disloyalty, must discover and expose the real spy without the help of his organization."
435,"Two separate sets of voluptuous women are stalked at different times by a scarred stuntman who uses his ""death proof"" cars to execute his murderous plans."
436,Follow a team of Naval criminal investigators who operate on the Hawaiian islands.
437,Jack Reacher must uncover the truth behind a major government conspiracy in order to clear his name while on the run as a fugitive from the law.
438,"A nurse, a policeman, a young married couple, a salesman and other survivors of a worldwide plague that is producing aggressive, flesh-eating zombies, take refuge in a mega Midwestern shopping mall."
439,An astronaut crash lands on a mysterious planet only to discover he's not alone.
440,"A retired CIA agent travels across Europe and relies on his old skills to save his estranged daughter, who has been kidnapped while on a trip to Paris."
441,Two brothers search for a Philosopher's Stone after an attempt to revive their deceased mother goes awry and leaves them in damaged physical forms.
442,A spy recently disavowed by the U.S. government uses his special ops training to help others in trouble.
443,An alien invasion threatens the future of humanity. The catastrophic nightmare is depicted through the eyes of one American family fighting for survival.
444,Three trappers protect the daughters of a British Colonel in the midst of the French and Indian War.
445,The new kid in school must battle a gang of street toughs after stealing the gang leader's girl.
446,"After barely surviving his grievous wounds from his mission in Dhaka, Bangladesh, Tyler Rake is back, and his team is ready to take on their next mission."
447,A pair of U.S. Navy fighter pilots risk their lives during the Korean War and become some of the Navy's most celebrated wingmen.
448,"A former DEA agent moves his family to a quiet town, where he soon tangles with a local meth druglord."
449,An intelligence operative for a shadowy global peacekeeping agency races to stop a hacker from stealing its most valuable and dangerous weapon.
450,"In the 1880s American West, murderous outlaw gang leader Frank Griffin hunts for ex-protege Roy Goode. Frank's chase leads him to La Belle, New Mexico--a town inhabited, after a mining disaster, almost entirely by women."
451,"-Resplendent with authentic 1980s music, fashion, and vibe, ""Miami Vice"" follows two undercover detectives and their extended team through the mean streets of Miami, Florida."
452,A team of commandos on a mission in a Central American jungle find themselves hunted by an extraterrestrial warrior.
453,"In a world divided by factions based on virtues, Tris learns she's Divergent and won't fit in. When she discovers a plot to destroy Divergents, Tris and the mysterious Four must find out what makes Divergents dangerous before it's too late."
454,"An interstellar teleportation device, found in Egypt, leads to a planet with humans resembling ancient Egyptians who worship the god Ra."
455,Follows the cases of the Miami-Dade Police Department's Crime Scene Investigation unit as they try to unveil the conditions behind mysterious deaths and crimes.
456,Forensic scientists and investigators of the New York City Police Department unveil the circumstances behind mysterious and unusual deaths.
457,Is a top secret organization dedicated to preventing mass extinction events and with the ability to make time go backwards.
458,"The story of 160 elite U.S. soldiers who dropped into Mogadishu in October 1993 to capture two top lieutenants of a renegade warlord, but found themselves in a desperate battle with a large force of heavily armed Somalis."
459,"Kyle and Swin live by the orders of an Arkansas-based drug kingpin named Frog, whom they've never met. But when a deal goes horribly wrong, the consequences are deadly."
460,Steven Grant discovers he's been granted the powers of an Egyptian moon god. But he soon finds out that these newfound powers can be both a blessing and a curse to his troubled life.
461,"An Indian agent races against a doomsday clock as a ruthless mercenary, with a bitter vendetta, mounts an apocalyptic attack against the country."
462,"In the 1960s, superpowered humans Charles Xavier and Erik Lensherr work together to find others like them, but Erik's vengeful pursuit of an ambitious mutant who ruined his life causes a schism to divide them."
463,"After accidentally crash-landing in 2022, time-traveling fighter pilot Adam Reed teams up with his 12-year-old self for a mission to save the future."
