,action
624,"In the Far East, Alex O'Connell, the son of famed mummy fighters Rick and Evy O'Connell, unearths the mummy of the first Emperor of Qin -- a shape-shifting entity cursed by a witch centuries ago."
625,A frustrated writer struggles to keep his family alive when a series of global catastrophes threatens to annihilate mankind.
626,"Jack Sparrow and Barbossa embark on a quest to find the elusive fountain of youth, only to discover that Blackbeard and his daughter are after it too."
627,"When a goddess of war reincarnates in the body of a young girl, street orphan Seiya discovers that he is destined to protect her and save the world. But only if he can face his own past and become a Knight of the Zodiac."
628,Peaceful farmer Benjamin Martin is driven to lead the Colonial Militia during the American Revolution when a sadistic British officer murders his son.
629,The futuristic misadventures and tragedies of an easygoing bounty hunter and his partners.
630,The quiet lives of three high school students with genetic superhuman abilities turn upside down when a mysterious organization starts to hunt them down one by one.
631,"When New York is put under siege by Oscorp, it is up to Spider-Man to save the city he swore to protect as well as his loved ones."
632,"As a war between humankind and monstrous sea creatures wages on, a former pilot and a trainee are paired up to drive a seemingly obsolete special weapon in a desperate effort to save the world from the apocalypse."
633,"Set in the near-future, technology controls nearly all aspects of life. But when the world of Grey, a self-labeled technophobe, is turned upside down, his only hope for revenge is an experimental computer chip implant."
634,"In a twist to the fairy tale, the Huntsman ordered to take Snow White into the woods to be killed winds up becoming her protector and mentor in a quest to vanquish the Evil Queen."
635,"Four Vietnam vets, framed for a crime they didn't commit, help the innocent while on the run from the military."
636,Violence ensues after an extraterrestrial race forced to live in slum-like conditions on Earth finds a kindred spirit in a government agent exposed to their biotechnology.
637,The merciless 1970s rivalry between Formula One rivals James Hunt and Niki Lauda.
638,"Amidst the decline of the Wild West at the turn of the 20th century, outlaw Arthur Morgan and his gang struggle to cope with the loss of their way of life."
639,A modern action adventure road story where a 17-year-old girl named Suzume helps a mysterious young man close doors from the other side that are releasing disasters all over in Japan.
640,The crew of the ship Serenity try to evade an assassin sent to recapture telepath River.
641,"Dave Lizewski is an unnoticed high school student and comic book fan who one day decides to become a superhero, even though he has no powers, training or meaningful reason to do so."
642,"Ash Ketchum, his yellow pet Pikachu, and his human friends explore a world of powerful creatures."
643,MMA fighter Cole Young seeks out Earth's greatest champions in order to stand against the enemies of Outworld in a high stakes battle for the universe.
644,Indiana Jones becomes entangled in a Soviet plot to uncover the secret behind mysterious artifacts known as the Crystal Skulls.
645,"A New York City advertising executive goes on the run after being mistaken for a government agent by a group of foreign spies, and falls for a woman whose loyalties he begins to doubt."
646,"Captain Barbossa, Will Turner and Elizabeth Swann must sail off the edge of the map, navigate treachery and betrayal, find Jack Sparrow, and make their final alliances for one last decisive battle."
647,Plot kept under wraps.
648,A veteran Green Beret is forced by a cruel Sheriff and his deputies to flee into the mountains and wage an escalating one-man war against his pursuers.
649,Retired CIA agent Frank Moses reunites his unlikely team of elite operatives for a global quest to track down a missing portable nuclear device.
650,"When anti-mutant Colonel William Stryker kidnaps Professor X and attacks his school, the X-Men must ally with their archenemy Magneto to stop him."
651,A true David vs. Goliath story of how the 14th century Scottish 'Outlaw King' Robert the Bruce used cunning and bravery to defeat the much larger and better equipped occupying English army.
652,A substance designed to help the brain repair itself gives advanced intelligence to a chimpanzee who leads an ape uprising.
653,"In the post-apocalyptic Australian wasteland, a cynical drifter agrees to help a small, gasoline-rich community escape a horde of bandits."
654,"As Steve Rogers struggles to embrace his role in the modern world, he teams up with a fellow Avenger and S.H.I.E.L.D agent, Black Widow, to battle a new threat from history: an assassin known as the Winter Soldier."
655,"Based on the story of Micky Ward, a fledgling boxer who tries to escape the shadow of his more famous but troubled older boxing brother and get his own shot at greatness."
656,"A professor moonlighting as a hit man of sorts for his city police department, descends into dangerous, dubious territory when he finds himself attracted to a woman who enlists his services."
657,"An untested American submarine captain teams with U.S. Navy Seals to rescue the Russian president, who has been kidnapped by a rogue general."
658,A family struggles for survival in the face of a cataclysmic natural disaster.
659,"A lawyer is sucked into an international conspiracy after being accused of a murder she didn't commit. Her only chance of survival lies in uncovering the secret of an old German WWII airplane, discovered on Iceland's largest glacier."
660,A family man is drafted to fight in a future war where the fate of humanity relies on his ability to confront the past.
661,"Two crew members of a spaceship wake up from hypersleep to discover that all their colleagues are missing. Despite this, it appears that they are not alone."
662,"While Batman deals with a deformed man calling himself the Penguin wreaking havoc across Gotham with the help of a cruel businessman, a female employee of the latter becomes the Catwoman with her own vendetta."
663,"After her mother disappears, Clary must venture into the dark world of demon hunting, and embrace her new role among the Shadowhunters."
664,Teresa flees Mexico after her drug-runner boyfriend is murdered. Settling in Dallas she looks to become the country's reigning drug smuggler and to avenge her lover's murder.
665,"Kora and surviving warriors prepare to defend Veldt, their new home, alongside its people against the Realm. The warriors face their pasts, revealing their motivations before the Realm's forces arrive to crush the growing rebellion."
666,A historian races to find the legendary Templar Treasure before a team of mercenaries.
667,"A deadly threat from Earth's history reappears and a hunt for a lost artifact takes place between Autobots and Decepticons, while Optimus Prime encounters his creator in space."
668,The fragile peace between apes and humans is threatened as mistrust and betrayal threaten to plunge both tribes into a war for dominance over the Earth.
669,"After making their way through high school (twice), big changes are in store for officers Schmidt and Jenko when they go deep undercover at a local college."
670,"Young Angus ""Mac"" MacGyver works for a clandestine organization within the U.S. government, relying on his unconventional problem-solving skills to save lives."
671,"Following a zombie outbreak in Las Vegas, a group of mercenaries take the ultimate gamble, venturing into the quarantine zone to pull off the greatest heist ever attempted."
672,A group of friends who meet regularly for game nights find themselves entangled in a real-life mystery when the shady brother of one of them is seemingly kidnapped by dangerous gangsters.
673,A cab driver finds himself the hostage of an engaging contract killer as he makes his rounds from hit to hit during one night in Los Angeles.
674,"D'Artagnan is forced to join forces with Milady to save Constance, who was kidnapped before his eyes. But as war is declared and Athos, Porthos and Aramis have already joined the front, a secret from the past shatters old alliances."
675,"After his wife is forced to give up 40 years of her life as payment for an insurance debt, a man desperately searches for a way to get them back."
676,A bank executive receives a bomb threat while driving his children to school that his car will explode if they stop and get out.
677,"Kamala, a superhero fan with an imagination--particularly when it comes to Captain Marvel--feels like she doesn't fit in at school and sometimes even at home, that is until she gets superpowers like the heroes she admires."
678,"IMF agent Ethan Hunt is sent to Sydney to find and destroy a genetically modified disease called ""Chimera""."
679,"A young man, falsely imprisoned by his jealous ""friend"", escapes and uses a hidden treasure to exact his revenge."
680,"The IMF is shut down when it's implicated in the bombing of the Kremlin, causing Ethan Hunt and his new team to go rogue to clear their organization's name."
681,"Six individuals from all around the globe, each the very best at what they do, have been chosen not only for their skill, but for a unique desire to delete their pasts to change the future."
682,The surreal misadventures of two best friends - a blue jay and a raccoon - as they seek to liven up their mundane jobs as groundskeepers at the local park.
683,"A mild-mannered chemist and an ex-con must lead the counterstrike when a rogue group of military men, led by a renegade general, threaten a nerve gas attack from Alcatraz against San Francisco."
684,An ordinary man frustrated with the various flaws he sees in society begins to psychotically and violently lash out against them.
685,"Nathan Algren, a US army veteran, is hired by the Japanese emperor to train his army in the modern warfare techniques. Nathan finds himself trapped in a struggle between two eras and two worlds."
686,"John Weir, a private espionage operative, battles over the preservation of democracy in a world constantly at odds."
687,"After the apes suffer unimaginable losses, Caesar wrestles with his darker instincts and begins his own mythic quest to avenge his kind."
688,"When Enola Holmes (Sherlock's teen sister) discovers her mother is missing, she endeavours to find her, becoming a super-sleuth in her own right as she outwits her famous brother and unravels a dangerous conspiracy."
689,"The early years of James Logan, featuring his rivalry with his brother Victor Creed, his service in the special forces team Weapon X, and his experimentation into the metal-lined mutant Wolverine."
690,A machine from a post-apocalyptic future travels back in time to protect a man and a woman from an advanced robotic assassin to ensure they both survive a nuclear attack.
691,"The former World Heavyweight Champion Rocky Balboa serves as a trainer and mentor to Adonis Johnson, the son of his late friend and former rival Apollo Creed."
692,Plot under wraps.
693,A rough-and-tumble trucker and his side kick face off with an ancient sorcerer in a supernatural battle beneath Chinatown.
694,"When Hiccup and Toothless discover an ice cave that is home to hundreds of new wild dragons and the mysterious Dragon Rider, the two friends find themselves at the center of a battle to protect the peace."
695,"The peace is suddenly broken when warning sirens blare through the Soul Society. Residents are disappearing without a trace and nobody knows who's behind it. Meanwhile, a darkness is approaching Ichigo and his friends in Karakura Town."
696,"When the network of satellites designed to control the global climate starts to attack Earth, it's a race against the clock for its creator to uncover the real threat before a worldwide Geostorm wipes out everything and everyone."
697,A street gang known as The Warriors must fight their way from the Bronx to their home turf on Coney Island when they are falsely accused of assassinating a respected gang leader.
698,"When Hiccup discovers Toothless isn't the only Night Fury, he must seek the Hidden World, a secret Dragon Utopia before a hired tyrant named Grimmel finds it first."
699,A young girl institutionalized by her abusive stepfather retreats to an alternative reality as a coping strategy and envisions a plan to help her escape.
700,"John works with the PreCrime police which stop crimes before they take place, with the help of three 'PreCogs' who can foresee crimes. Events ensue when John finds himself framed for a future murder."
701,Former cop Brian O'Conner is called upon to bust a dangerous criminal and he recruits the help of a former childhood friend and street racer who has a chance to redeem himself.
702,The plot is unknown at this time.
703,A crew of oceanic researchers working for a deep sea drilling company try to get to safety after a mysterious earthquake devastates their deepwater research and drilling facility located at the bottom of the Mariana Trench.
704,"Freedom fighters Neo, Trinity and Morpheus continue to lead the revolt against the Machine Army, unleashing their arsenal of extraordinary skills and weaponry against the systematic forces of repression and exploitation."
705,"The enchanted lives of a couple in a secluded forest are brutally shattered by a nightmarish hippie cult and their demon-biker henchmen, propelling a man into a spiraling, surreal rampage of vengeance."
706,"Theseus is a mortal man chosen by Zeus to lead the fight against the ruthless King Hyperion, who is on a rampage across Greece to obtain a weapon that can destroy humanity."
707,The 'Bad Batch' of elite and experimental clones make their way through an ever-changing galaxy in the immediate aftermath of the Clone Wars.
708,Former musician and gunslinger El Mariachi arrives at a small Mexican border town after being away for a long time. His past quickly catches up with him and he soon gets entangled with the local drug kingpin Bucho and his gang.
709,"A dark force threatens Alpha, a vast metropolis and home to species from a thousand planets. Special operatives Valerian and Laureline must race to identify the marauding menace and safeguard not just Alpha, but the future of the universe."
710,"When Tony Stark's world is torn apart by a formidable terrorist called the Mandarin, he starts an odyssey of rebuilding and retribution."
711,"Selene, a vampire warrior, is entrenched in a conflict between vampires and werewolves, while falling in love with Michael, a human who is sought by werewolves for unknown reasons."
712,"After a supernatural event at his church, a preacher enlists the help of a vampire and his ex to find God."
713,"With the world now aware of his identity as Iron Man, Tony Stark must contend with both his declining health and a vengeful mad man with ties to his father's legacy."
714,The 8th entry in the long running Mission Impossible franchise.
715,"After their cave is destroyed, a caveman family must trek through an unfamiliar fantastical world with the help of an inventive boy."
716,Deckard Shaw seeks revenge against Dominic Toretto and his family for his comatose brother.
717,"Hanagaki Takemichi lives an unsatisfying life right up until his death. Waking up 12 years in the past, he reckons with the eventual fate of his friends and tries to prevent an unfortunate future."
718,"Revolves around the extraordinary journey of Tejas Gill, an Air Force pilot, and aims to inspire and instill a deep sense of pride in the valiant soldiers who tirelessly defend India, confronting numerous challenges along the way."
719,"Marinette and Adrien, two normal teens, transform into the superheroes Ladybug and Cat Noir when a mysterious evil threatens to destroy Paris."
720,"Batman must battle former district attorney Harvey Dent, who is now Two-Face and Edward Nygma, The Riddler with help from an amorous psychologist and a young circus acrobat who becomes his sidekick, Robin."
721,"A prequel, set before the events of Army of the Dead, which focuses on German safecracker Ludwig Dieter leading a group of aspiring thieves on a top secret heist during the early stages of the zombie apocalypse."
722,"While on a journey of physical and spiritual healing, a brilliant neurosurgeon is drawn into the world of the mystic arts."
723,"Kratos and his son Atreus face the oncoming Norse apocalypse, Ragnarok."
724,Three very different criminals team up for a series of heists and walk into some of the most thrilling experiences in the corrupt city of Los Santos.
725,"Returning from LV-426, Ellen Ripley crash-lands on the maximum-security prison Fiorina 161, where she discovers that she has unwittingly brought along an unwelcome visitor."
726,A man blinded by toxic waste which also enhanced his remaining senses fights crime as an acrobatic martial arts superhero.
727,A soldier wakes up in someone else's body and discovers he's part of an experimental government program to find the bomber of a commuter train within 8 minutes.
728,Batman and Robin try to keep their relationship together even as they must stop Mr. Freeze and Poison Ivy from freezing Gotham City.
729,"During an experiment into time travel, a scientist finds himself trapped in the past, ""leaping"" into the lives of different people, sorting out their problems and changing history in hopes of getting back to his own life in the present."
730,"In an alternate Victorian Age world, a group of famous contemporary fantasy, science fiction, and adventure characters team up on a secret mission."
731,"Farmers from a village exploited by bandits hire a veteran samurai for protection, who gathers six other samurai to join him."
732,"Fugitive Jesse Pinkman runs from his captors, the law, and his past."
733,"Follows the actions of Section 20, a secretive unit of British military intelligence. A team of special operations personnel conduct several high risk missions across the globe."
734,A sarcastic humanoid duck is pulled from his homeworld to Earth where he must stop an alien invasion with the help of a nerdy scientist and a struggling female rock singer.
735,"Years after a plague kills most of humanity and transforms the rest into monsters, the sole survivor in New York City struggles valiantly to find a cure."
736,An enigmatic figure who uses her extensive skills to help those with nowhere else to turn.
737,A veteran assigned to extract Earth's remaining resources begins to question what he knows about his mission and himself.
738,Robin Hood decides to fight back as an outlaw when faced with the tyranny of the Sheriff of Nottingham.
739,"Marcus Luttrell and his team set out on a mission to capture or kill notorious Taliban leader Ahmad Shah, in late June 2005. Marcus and his team are left to fight for their lives in one of the most valiant efforts of modern warfare."
740,"The true story of Captain Richard Phillips and the 2009 hijacking by Somali pirates of the U.S.-flagged MV Maersk Alabama, the first American cargo ship to be hijacked in two hundred years."
741,"A female gunfighter returns to a frontier town where a dueling tournament is being held, which she enters in an effort to avenge her father's death."
742,"A live-action adaptation of Nickelodeon's Winx Club (2004). It follows Bloom as she adjusts to life in the Otherworld, where she must learn to control her dangerous magical powers."
743,James Bond descends into mystery as he tries to stop a mysterious organisation from eliminating a country's most valuable resource.
744,"The human government develops a cure for mutations, and Jean Gray becomes a darker uncontrollable persona called the Phoenix who allies with Magneto, causing escalation into an all-out battle for the X-Men."
745,"In the early 1960s, CIA agent Napoleon Solo and KGB operative Illya Kuryakin participate in a joint mission against a mysterious criminal organization, which is working to proliferate nuclear weapons."
746,A retired master car thief must come back to the industry and steal fifty cars with his crew in one night to save his brother's life.
747,"In a violent, futuristic city where the police have the authority to act as judge, jury and executioner, a cop teams with a trainee to take down a gang that deals the reality-altering drug, SLO-MO."
748,"In the year 2154, the very wealthy live on a man-made space station while the rest of the population resides on a ruined Earth. A man takes on a mission that could bring equality to the polarized worlds."
749,Agent J is sent to find Agent K and restore his memory after the re-appearance of a case from K's past.
750,"In the aftermath of a massive earthquake in California, a rescue-chopper pilot makes a dangerous journey with his ex-wife across the state in order to rescue his daughter."
751,"After being set-up and betrayed by the man who hired him to assassinate a Texas Senator, an ex-Federale launches a brutal rampage of revenge against his former boss."
752,"A cryptic message from James Bond's past sends him on a trail to uncover the existence of a sinister organisation named SPECTRE. With a new threat dawning, Bond learns the terrible truth about the author of all his pain in his most recent missions."
753,Two hip detectives protect a witness to a murder while investigating a case of stolen heroin from the evidence storage room from their police precinct.
754,The crew of a naval destroyer is forced to confront the reality of a new existence when a pandemic kills off most of the earth's population.
755,"Diana must contend with a work colleague, and with a businessman whose desire for extreme wealth sends the world down a path of destruction, after an ancient artifact that grants wishes goes missing."
756,A demystified take on the tale of King Arthur and the Knights of the Round Table.
757,"In a small town in Arizona, a mysterious man/spirit descends from the sky and manifests in a sports car and targets a local violent road-racing gang of motor heads, headed by a ruthless bully who'll do anything to get what he wants."
758,Two spies are recruited by an intelligence agency. They pose as a married couple Mr. and Mrs. Smith when they are on their missions.
759,"An elite covert operations unit carries out highly sensitive missions subject to official denial in the event of failure, death or capture."
760,A group of troublemaking boys decide to take a stand when terrorists seize control of their boarding school.
761,"Tyler Rake, a fearless black market mercenary, embarks on the most deadly extraction of his career when he's enlisted to rescue the kidnapped son of an imprisoned international crime lord."
762,"A high school swim champion with a troubled past enrolls in the U.S. Coast Guard's ""A"" School, where legendary rescue swimmer Ben Randall teaches him some hard lessons about loss, love, and self-sacrifice."
763,"Obsessed with vengeance, a man sets out to find out why he was kidnapped and locked into solitary confinement for twenty years without reason."
764,"During the summer of 1979, a group of friends witness a train crash and investigate subsequent unexplained events in their small town."
765,"17-year-old Zoe Hull uses her wits, survival skills, and compassion to fight for her life, and those of her fellow classmates, against a group of live-streaming school shooters."
766,"Looking for a part-time job, 13-year-old Henry Hart lands the post of sidekick of superhero Captain Man, but he must keep this a secret from his family and friends."
767,"When an outlaw discovers his enemy is being released from prison, he reunites his gang to seek revenge."
768,"A young woman starts to get messages from an unknown number that claims to be her deceased father. Trying to uncover the truth, she stumbles upon a larger conspiracy involving the singularity."
769,"A shy adolescent learns that she comes from a fabled royal family of legendary sea krakens and that her destiny lies in the depths of the waters, which is bigger than she could have ever imagined."
770,"Bound by a shared destiny, a teen bursting with scientific curiosity and a former boy-genius inventor embark on a mission to unearth the secrets of a place somewhere in time and space that exists in their collective memory."
771,A mysterious force knocks the moon from its orbit and sends it hurtling on a collision course toward earth.
772,"The Pevensie siblings return to Narnia, where they are enlisted to once again help ward off an evil king and restore the rightful heir to the land's throne, Prince Caspian."
773,Teela joins forces with He-Man and the other Masters in their quest to save Eternia from the grip of darkness.
774,A quirky spy show of the adventures of eccentrically suave British Agent John Steed and his predominantly female partners.
775,"The crew of Los Angeles County Fire Department Station 51, particularly the paramedic team, and Rampart Hospital respond to emergencies in their operating area."
776,A frustrated man decides to take justice into his own hands after a plea bargain sets one of his family's killers free.
777,"The crew of the USS Enterprise explores the furthest reaches of uncharted space, where they encounter a new ruthless enemy, who puts them, and everything the Federation stands for, to the test."
778,"Almost two years after a virus wiped out most of the human race, Phil Miller only wishes for some company, but soon gets more than he bargained for when that company shows up in the form of other survivors."
779,A slightly unhinged cop is partnered with a veteran detective trying to maintain a low stress level in his life.
