,action
464,"In a future where a failed climate change experiment has killed all life except for the survivors who boarded the Snowpiercer (a train that travels around the globe), a new class system emerges."
465,An F.B.I. Agent goes undercover to catch a gang of surfers who may be bank robbers.
466,"Four friends, partying in a house in the middle of nowhere are brutally attacked by a man and his son, forcing the remaining women to take vengeance upon them."
467,"To everyone's surprise, including his own, Po, an overweight, clumsy panda, is chosen as protector of the Valley of Peace. His suitability will soon be tested as the valley's arch-enemy is on his way."
468,"After the Rebels are overpowered by the Empire, Luke Skywalker begins his Jedi training with Yoda, while his friends are pursued across the galaxy by Darth Vader and bounty hunter Boba Fett."
469,A group of scientists exploring the Marianas Trench encounter the largest marine predator that has ever existed - the Megalodon.
470,A C.I.A. operative on the edge of retirement discovers a family secret and is called back into the field for one last job.
471,"Dr. Richard Kimble, unjustly accused of murdering his wife, must find the real killer while being the target of a nationwide manhunt led by a seasoned U.S. Marshal."
472,An immortal Scottish swordsman faces off with other immortal warriors in order to obtain a coveted ability.
473,"Seven years after he survived the monster apocalypse, lovably hapless Joel leaves his cozy underground bunker behind on a quest to reunite with his high school sweetheart."
474,"Blends the style of classic sitcoms with the MCU, in which Wanda Maximoff and Vision - two super-powered beings living their ideal suburban lives - begin to suspect that everything is not as it seems."
475,Batman is manipulated by Lex Luthor to fear Superman. Superman´s existence is meanwhile dividing the world and he is framed for murder during an international crisis. The heroes clash and force the neutral Wonder Woman to reemerge.
476,"A skilled London police officer, after irritating superiors with his embarrassing effectiveness, is transferred to a village where the easygoing officers object to his fervor for regulations, as a string of grisly murders strikes the town."
477,"The Dark Knight of Gotham City begins his war on crime with his first major enemy being Jack Napier, a criminal who becomes the clownishly homicidal Joker."
478,A martial arts master agrees to teach karate to a bullied teenager.
479,"After rescuing Han Solo from Jabba the Hutt, the Rebels attempt to destroy the second Death Star, while Luke struggles to help Darth Vader back from the dark side."
480,"Board the Millennium Falcon and journey to a galaxy far, far away in an epic action-adventure that will set the course of one of the Star Wars saga's most unlikely heroes."
481,The people of Wakanda fight to protect their home from intervening world powers as they mourn the death of King T'Challa.
482,"Eddy persuades his three pals to pool money for a vital poker game against a powerful local mobster, Hatchet Harry. Eddy loses, after which Harry gives him a week to pay back 500,000 pounds."
483,"Follows an NCIS team that investigates criminal cases involving military personnel in The Big Easy, a city known for its music, entertainment, and decadence."
484,"As a math savant uncooks the books for a new client, the Treasury Department closes in on his activities, and the body count starts to rise."
485,"David Haller is a troubled young man diagnosed as schizophrenic, but after a strange encounter he discovers special powers that will change his life forever."
486,"Global spy agency Citadel has fallen, and its agents' memories were wiped clean. Now the powerful syndicate, Manticore, is rising in the void. Can the Citadel agents recollect their past and summon the strength to fight back?"
487,The adventures of a Hawaii-based private investigator.
488,"A young boy, Conan, becomes a slave after his parents are killed and tribe destroyed by a savage warlord and sorcerer, Thulsa Doom. When he grows up he becomes a fearless, invincible fighter. Set free, he plots revenge against Thulsa Doom."
489,"In 2029, an Air Force astronaut crash-lands on a mysterious planet where evolved, talking apes dominate a race of primitive humans."
490,Sonic in a high-octane adventure where the fate of a strange new multiverse rests in his gloved hands.
491,"When a knight in a futuristic medieval world is framed for a crime he didn't commit, the only one who can help him prove his innocence is Nimona -- a mischievous teen who happens to be a shapeshifting creature he's sworn to destroy."
492,"Following a betrayal, a young man left for dead is reborn as a powerful devil-human hybrid after merging with his pet devil and is soon enlisted into an organization dedicated to hunting devils."
493,A CIA operative and his translator flee from special forces in Afghanistan after exposing a covert mission.
494,"Xena, a mighty Warrior Princess with a dark past, sets out to redeem herself. She is joined by small town bard, Gabrielle. Together they journey the ancient world and fight for the greater good against ruthless Warlords and Gods."
495,SAS: Rogue Heroes charts the creation of the famed Special Forces unit. Based on the book by Ben Macintyre.
496,"A research team is sent to the Jurassic Park Site B island to study the dinosaurs there, while an InGen team approaches with another agenda."
497,An Interpol agent successfully tracks down the world's most wanted art thief with help from a rival thief. But nothing is as it seems as a series of double-crosses ensues.
498,"Three years into the Clone Wars, Obi-Wan pursues a new threat, while Anakin is lured by Chancellor Palpatine into a sinister plot to rule the galaxy."
499,"During an attack on a U.S. compound in Libya, a security team struggles to make sense out of the chaos."
500,"The series focuses on a single Harley Quinn, who sets off to make it on her own in Gotham City."
501,"Tom Lee, a Chinese-American boy, after the death of his grandmother, has to be apprenticed to the talking tiger Mr. Hu and learn ancient magic to become the new guardian of an ancient phoenix."
502,"James Bond's loyalty to M is tested when her past comes back to haunt her. When MI6 comes under attack, 007 must track down and destroy the threat, no matter how personal the cost."
503,Political involvement in the Avengers' affairs causes a rift between Captain America and Iron Man.
504,"Columbus, Tallahassee, Wichita, and Little Rock move to the American heartland as they face off against evolved zombies, fellow survivors, and the growing pains of the snarky makeshift family."
505,"When the world's seven most advanced robots and their human allies are murdered one by one, inspector Gesicht soon discovers that he's also in danger."
506,"A widowed father returns to Austin after one year, attempting to reconnect with his children, navigate clashes with his family, and find common ground with his new partner, while growing increasingly suspicious of his wife's death."
507,"Sydney Bristow is an international spy recruited out of college, trained for espionage and self-defense."
508,Plot unknown. Fourth installment of the 'Bad Boys' film series.
509,"As homicide detective Thomas Craven investigates the murder of his activist daughter, he uncovers a corporate cover-up and government conspiracy that attracts an agent tasked with cleaning up the evidence."
510,"Time-traveling rogue Rip Hunter must recruit a ragtag team of heroes and villains to help prevent an apocalypse that could impact not only Earth, but all of time."
511,"A comet is discovered to be on a collision course with Earth. As doomsday nears, the human race prepares for the worst."
512,A tale of war and romance mixed in with history. The story follows two lifelong friends and a beautiful nurse who are caught up in the horror of an infamous Sunday morning in 1941.
513,"An origin story set on Cybertron, home of both the Autobots and the Decepticons. The film is said to focus on the relationship between Optimus Prime and Megatron"
514,A high school becomes ground zero for a zombie virus outbreak. Trapped students must fight their way out or turn into one of the rabid infected.
515,A brave and clever ragtag starship crew stands up against the evil Empire as it tightens its grip on the galaxy and hunts down the last of the Jedi Knights.
516,"Supernatural exorcist and demonologist John Constantine helps a policewoman prove her sister's death was not a suicide, but something more."
517,"A magical meteor crash lands in Adventure City and gives the PAW Patrol pups superpowers, transforming them into The Mighty Pups"
518,Debbie Ocean gathers an all-female crew to attempt an impossible heist at New York City's annual Met Gala.
519,"An augmented human and Sarah Connor must stop an advanced liquid Terminator from hunting down a young girl, whose fate is critical to the human race."
520,"Asta and Yuno were abandoned together at the same church and have been inseparable since. As children, they promised that they would compete against each other to see who would become the next Emperor Magus."
521,"Nearly 5,000 years after he was bestowed with the almighty powers of the Egyptian gods--and imprisoned just as quickly--Black Adam is freed from his earthly tomb, ready to unleash his unique form of justice on the modern world."
522,Natasha Romanoff confronts the darker parts of her ledger when a dangerous conspiracy with ties to her past arises.
523,"The aliens are coming and their goal is to invade and destroy Earth. Fighting superior technology, mankind's best weapon is the will to survive."
524,Beneath Anna Poliatova's striking beauty lies a secret that will unleash her indelible strength and skill to become one of the world's most feared government assassins.
525,Jen is a self-aware young woman who lives in a world where everybody except her has a superpower.
526,Seven gunmen from a variety of backgrounds are brought together by a vengeful young widow to protect her town from the private army of a destructive industrialist.
527,The human stories on both sides of the Israel-Palestine conflict.
528,"A New York City architect becomes a one-man vigilante squad after his wife is murdered by street punks. In self-defense, the vengeful man kills muggers on the mean streets after dark."
529,"Transporter Frank Martin, surfaces in Miami, Florida and is implicated in the kidnapping of the young son of a powerful USA official."
530,"Jack Sparrow races to recover the heart of Davy Jones to avoid enslaving his soul to Jones' service, as other friends and foes seek the heart for their own agenda as well."
531,"Shang-Chi, the master of weaponry-based Kung Fu, is forced to confront his past after being drawn into the Ten Rings organization."
532,"A woman, accidentally caught in a dark deal, turns the tables on her captors and transforms into a merciless warrior evolved beyond human logic."
533,"A straight-laced bank manager about to marry the love of his life. When his bank is held up by infamous Ghost Bandits during his wedding week, he believes his future in-laws who just arrived in town, are the infamous Out-Laws."
534,Two robbers steal an ambulance after their heist goes awry.
535,"When a group of strangers at a dusty roadside diner come under attack by demonic forces, their only chance for survival lies with an archangel named Michael, who informs a pregnant waitress that her unborn child is humanity's last hope."
536,"During World War II, several oddly assorted military experts are teamed in a mission to raid and destroy a bridge vital to enemy strategy."
537,"While strange rumors about their ill King grip a kingdom, the crown prince becomes their only hope against a mysterious plague overtaking the land."
538,Japan is plunged into chaos upon the appearance of a giant monster.
539,"Guts, a wandering mercenary, joins the Band of the Hawk after being defeated in a duel by Griffith, the group's leader and founder. Together, they dominate every battle, but something menacing lurks in the shadows."
540,Detective Axel Foley finds himself drawn back to the opulent environs of Beverly Hills to investigate the untimely demise of a long-time confidant.
541,"Several months after the U.S. entry into World War II, an inexperienced U.S. Navy commander must lead an Allied convoy being stalked by a German submarine wolf pack."
542,"The support crew serving on one of Starfleet's least important ships, the U.S.S. Cerritos, have to keep up with their duties, often while the ship is being rocked by a multitude of sci-fi anomalies."
543,IMF agent Ethan Hunt comes into conflict with a dangerous and sadistic arms dealer who threatens his life and his fiancée in response.
544,Detective Sherlock Holmes and his stalwart partner Watson engage in a battle of wits and brawn with a nemesis whose plot is a threat to all of England.
545,"When Tony Stark and Bruce Banner try to jump-start a dormant peacekeeping program called Ultron, things go horribly wrong and it's up to Earth's mightiest heroes to stop the villainous Ultron from enacting his terrible plan."
546,"A shy student trying to reach his family in Ohio, a gun-toting bruiser in search of the last Twinkie and a pair of sisters striving to get to an amusement park join forces in a trek across a zombie-filled America."
547,"Into a world of magicians is born Mash, a young boy who lacks magic but is the strongest person around. His existence and destiny will change his world."
548,"A marksman living in exile is coaxed back into action after hearing of a plot to kill the President. After being-double crossed for the attempt and on the run, he sets out for the real killer and the truth."
549,An elite unit of the LA County Sheriff's Dept. and the state's most successful bank robbery crew clash as the outlaws plan a seemingly impossible heist on the Federal Reserve Bank.
550,"The drug war on the U.S.-Mexico border has escalated as the cartels have begun trafficking terrorists across the US border. To fight the war, federal agent Matt Graver re-teams with the mercurial Alejandro."
551,"Years after a friend and fellow 00 agent is killed on a joint mission, a secret space based weapons program known as ""GoldenEye"" is stolen. James Bond is assigned to stop a Russian crime syndicate from using the weapon."
552,"A greedy film producer assembles a team of moviemakers and sets out for the infamous Skull Island, where they find more than just cannibalistic natives."
553,"A retired Special Forces colonel tries to save his daughter, who was abducted by his former subordinate."
554,"A strange black entity from another world bonds with Peter Parker and causes inner turmoil as he contends with new villains, temptations, and revenge."
555,"The story of Saitama, a hero that does it just for fun & can defeat his enemies with a single punch."
556,An eccentric genius forms an international network of super-geniuses to act as the last line of defense against the complicated threats of the modern world.
557,"On May 10, 1996, mountain guides Rob Hall and Scott Fischer combine their expedition teams for a final ascent to the summit of Mount Everest. With little warning, a storm strikes the mountain and the climbers must now battle to survive."
558,"A Street Kid trying to survive in a technology and body modification-obsessed city of the future. Having everything to lose, he chooses to stay alive by becoming an Edgerunner, a Mercenary outlaw also known as a Cyberpunk."
559,"After being betrayed and left for dead in Italy, Charlie Croker and his team plan an elaborate gold heist against their former ally."
560,"James Bond is sent to investigate the connection between a North Korean terrorist and a diamond mogul, who is funding the development of an international space weapon."
561,A successful cocaine dealer gets two tough assignments from his boss on the eve of his planned early retirement.
562,"After splitting with the Joker, Harley Quinn joins superheroines Black Canary, Huntress, and Renee Montoya to save a young girl from an evil crime lord."
563,"The Guardians struggle to keep together as a team while dealing with their personal family issues, notably Star-Lord's encounter with his father, the ambitious celestial being Ego."
564,"Ten years after initially meeting, Anakin Skywalker shares a forbidden romance with Padmé Amidala, while Obi-Wan Kenobi discovers a secret clone army crafted for the Jedi."
565,"To foil a terrorist plot, FBI agent Sean Archer assumes the identity of the criminal Castor Troy who murdered his son through facial transplant surgery, but the crook wakes up prematurely and vows revenge."
566,"The Star Wars saga continues as new heroes and galactic legends go on an epic adventure, unlocking mysteries of the Force and shocking revelations of the past."
567,"After the Kingsman's headquarters is destroyed and the world is held hostage, an allied spy organization in the United States is discovered. These two elite secret agencies must band together to defeat a common enemy."
568,"In a post-apocalyptic world where cities ride on wheels and consume each other to survive, two people meet in London and try to stop a conspiracy."
569,"When Earth is on the verge of an alien invasion, five teenagers, who are infused with superhuman abilities, must harness their newfound powers to battle this threat - as the Power Rangers."
570,"In 1997, when the U.S. president crashes into Manhattan, now a giant maximum security prison, a convicted bank robber is sent in to rescue him."
571,"After discovering a small, blue, fast hedgehog, a small-town police officer must help him defeat an evil genius who wants to do experiments on him."
572,"A man living in a futuristic sterile colony begins to question his circumscribed existence when his friend is chosen to go to the Island, the last uncontaminated place on earth."
573,A young man is bestowed with incredible martial arts skills and a mystical force known as the Iron Fist.
574,The Caped Crusader and his young ward battle evildoers in Gotham City.
575,"A failed reporter is bonded to an alien entity, one of many symbiotes who have invaded Earth. But the being takes a liking to Earth and decides to protect it."
576,Jane Doe is found in Times Square with no memory and mysterious tattoos on her body.
577,"A lost alien seeks help to go back to his home, but everything gets harder after the alien returns to its home."
578,"The cases of Harmon Rabb, former Navy fighter pilot, and his fellow lawyers of the U.S. Navy's Judge Advocate General's office."
579,A rookie air force combat controller and a seasoned drone pilot support a Delta Force team as they try to shift a mission gone wrong into a rescue operation.
580,"A deactivated cyborg's revived, but can't remember anything of her past and goes on a quest to find out who she is."
581,"The powerful but arrogant god Thor is cast out of Asgard to live amongst humans in Midgard (Earth), where he soon becomes one of their finest defenders."
582,"Ballerina Dominika Egorova is recruited to 'Sparrow School,' a Russian intelligence service where she is forced to use her body as a weapon. Her first mission, targeting a C.I.A. agent, threatens to unravel the security of both nations."
583,"Brian O'Conner, back working for the FBI in Los Angeles, teams up with Dominic Toretto to bring down a heroin importer by infiltrating his operation."
584,"A half-vampire, half-mortal man becomes a protector of the mortal race, while slaying evil vampires."
585,"One of Marvel's most iconic families makes it back to the big screen, the Fantastic Four."
586,Bank clerk Stanley Ipkiss is transformed into a manic superhero when he wears a mysterious mask.
587,"Special Agent Simone Clark, the oldest rookie in the FBI Academy, is assigned to support the LA field office."
588,"With the help of the powerful Dragonballs, a team of fighters led by the saiyan warrior Goku defend the planet earth from extraterrestrial enemies."
589,A tough bouncer is hired to tame a dirty bar.
590,A newly fostered young boy in search of his mother instead finds unexpected super powers and soon gains a powerful enemy.
591,Peter Parker is beset with troubles in his failing personal life as he battles a former brilliant scientist named Otto Octavius.
592,"Bill and Jo Harding, advanced storm chasers on the brink of divorce, must join together to create an advanced weather alert system by putting themselves in the cross-hairs of extremely violent tornadoes."
593,"Navy S.E.A.L. sniper Chris Kyle's pinpoint accuracy saves countless lives on the battlefield and turns him into a legend. Back home with his family after four tours of duty, however, Chris finds that it is the war he can't leave behind."
594,"In ancient China, a young boy dreams of becoming the greatest general of the Qin Kingdom."
595,"Loyalties are tested when five friends and former special forces operatives reunite to take down a South American drug lord, unleashing a chain of unintended consequences."
596,"Eddie Brock attempts to reignite his career by interviewing serial killer Cletus Kasady, who becomes the host of the symbiote Carnage and escapes prison after a failed execution."
597,"The story of the Joestar family, who are possessed with intense psychic strength, and the adventures each member encounters throughout their lives."
598,"Set in a fictional country called Daeho, it is about the love and growth of young mages as they overcome their twisted fates due to a forbidden magic spell known as the ""alchemy of souls"", which allows souls to switch bodies."
599,"Following the events of Avengers: Endgame (2019), Spider-Man must step up to take on new threats in a world that has changed forever."
600,A vampire hunter fights to save a besieged city from an army of otherworldly creatures controlled by Dracula.
601,A developer attempts to sabotage the safety record of a ski resort.
602,"Mortal hero Bek teams with the god Horus in an alliance against Set, the merciless god of darkness, who has usurped Egypt's throne, plunging the once peaceful and prosperous empire into chaos and conflict."
603,"Reeves will reprise his role as supernatural exorcist and demonologist John Constantine. Who, in the original is dying, but sticks around to save his soul by keeping demons in hell from breaching earth."
604,A group of supervillains are recruited to go on missions for the government.
605,The Incredibles family takes on a new mission which involves a change in family roles: Bob Parr (Mr. Incredible) must manage the house while his wife Helen (Elastigirl) goes out to save the world.
606,A young police officer must prevent a bomb exploding aboard a city bus by keeping its speed above 50 mph.
607,"When the island's dormant volcano begins roaring to life, Owen and Claire mount a campaign to rescue the remaining dinosaurs from this extinction-level event."
608,"In the mid 23rd century, the Earth Alliance space station Babylon 5, located in neutral territory, is a major focal point for political intrigue, racial tensions and various wars over the course of five years."
609,A police officer is brought out of suspended animation in prison to pursue an old ultra-violent nemesis who is loose in a non-violent future society.
610,A boy who is half human and half deer survives in a post-apocalyptic world with other hybrids.
611,"After Peter Parker is bitten by a genetically altered spider, he gains newfound, spider-like powers and ventures out to save the city from the machinations of a mysterious reptilian foe."
612,"Krypto the Super-Dog and Superman are inseparable best friends, sharing the same superpowers and fighting crime side by side in Metropolis. However, Krypto must master his own powers for a rescue mission when Superman is kidnapped."
613,"A retiring assassin suddenly finds himself on the receiving end of a hit, contracted by none other than his own employer seeking to cash in on the pensions of aging employees."
614,Two Irish Catholic brothers become vigilantes and wipe out Boston's criminal underworld in the name of God.
615,"Robbed of his birthright, Arthur comes up the hard way in the back alleys of the city. But once he pulls the sword from the stone, he is forced to acknowledge his true legacy - whether he likes it or not."
616,Avatar Korra fights to keep Republic City safe from the evil forces of both the physical and spiritual worlds.
617,"After the crew of the Enterprise find an unstoppable force of terror from within their own organization, Captain Kirk leads a manhunt to a war-zone world to capture a one-man weapon of mass destruction."
618,"A man is picked up by a fishing boat, bullet-riddled and suffering from amnesia, before racing to elude assassins and attempting to regain his memory."
619,"Drama series following Lana Washington, an experienced bomb disposal officer working for the Metropolitan Police."
620,Ethan and his team take on their most impossible mission yet when they have to eradicate an international rogue organization as highly skilled as they are and committed to destroying the IMF.
621,"When a kingpin threatens New York City, a group of mutated turtle warriors must emerge from the shadows to protect their home."
622,"When Amber Chesborough goes missing along the Colombia-Venezuela border, her brother and her husband struggle to find her against the backdrop of a secret war."
623,Bounty hunter Boba Fett and mercenary Fennec Shand navigate the underworld when they return to Tatooine to claim Jabba the Hutt's old turf.
