,action
0,Itinerant former military policeman Jack Reacher solves crimes and metes out his own brand of street justice. Based on the novels by Lee Child.
1,Follows a master thief and his Interpol Agent ex-girlfriend who team up to steal $500 million in gold bullion being transported on an A380 passenger flight.
2,"Maya Lopez must face her past, reconnect with her Native American roots and embrace the meaning of family and community if she ever hopes to move forward."
3,"One man's brutal campaign for vengeance takes on national stakes after he is revealed to be a former operative of a powerful and clandestine organization known as ""Beekeepers""."
4,Demigod Percy Jackson leads a quest across America to prevent a war among the Olympian gods.
5,"Follows Charles Sun, a Taipei gangster who's settled into his life as a ruthless killer, but must go to L.A. to protect his mother and younger brother after his father was shot by a mysterious assassin."
6,"Nine noble families fight for control over the lands of Westeros, while an ancient enemy returns after being dormant for a millennia."
7,"An epic that details the checkered rise and fall of French Emperor Napoleon Bonaparte and his relentless journey to power through the prism of his addictive, volatile relationship with his wife, Josephine."
8,"Set after the battle between Godzilla and the Titans, revealing that monsters are real, follows one family's journey to uncover its buried secrets and a legacy linking them to Monarch."
9,A group of vigilantes set out to take down corrupt superheroes who abuse their superpowers.
10,"Eddie Halstead inherits a large estate from his father, unaware it fronts Pearson's drug empire. With no crime experience, he must take over the operation or lose the estate."
11,"When a peaceful settlement on the edge of a distant moon finds itself threatened by the armies of a tyrannical ruling force, a mysterious stranger living among its villagers becomes their best hope for survival."
12,"Back to his golden age before the events of ""Money Heist,"" Berlin and a masterful gang gather in Paris to plan one of his most ambitious robberies ever."
13,An introverted spy novelist is drawn into the activities of a sinister underground syndicate.
14,"Carol Danvers gets her powers entangled with those of Kamala Khan and Monica Rambeau, forcing them to work together to save the universe."
15,"Against the backdrop of a war between humans and robots with artificial intelligence, a former soldier finds the secret weapon, a robot in the form of a young child."
16,"Emma has a wonderful husband and two kids in the suburbs of New Jersey. She also has a secret life as an assassin for hire, a secret that her husband Dave discovers when the couple decide to spice up their marriage with a little role play."
17,"After a global pandemic destroys civilization, a hardened survivor takes charge of a 14-year-old girl who may be humanity's last hope."
18,"Black Manta seeks revenge on Aquaman for his father's death. Wielding the Black Trident's power, he becomes a formidable foe. To defend Atlantis, Aquaman forges an alliance with his imprisoned brother. They must protect the kingdom."
19,"Two strangers land jobs with a spy agency that offers them a life of espionage, wealth, and travel. The catch: new identities in an arranged marriage."
20,"Starting over isn't easy, especially for John Nolan who, after a life-altering incident, is pursuing his dream of joining the LAPD. As their oldest rookie, he's met with skepticism from those who see him as just a walking midlife crisis."
21,"A father, who is often away due to work, is unable to comprehend the intensity of his son's fervent love and admiration, which creates conflict between both of them."
22,"In a world of gifted hunters and monsters, a weak hunter Sung Jinwoo gains extraordinary powers through a mysterious program, leading him to become one of the strongest hunters and conquering even the strongest dungeons."
23,Coriolanus Snow mentors and develops feelings for the female District 12 tribute during the 10th Hunger Games.
24,"An internal succession war within House Targaryen at the height of its power, 172 years before the birth of Daenerys Targaryen."
25,"During WWII, five miles above the ground and behind enemy lines, ten men inside a bomber known as a ""Flying Fortress"" battle unrelenting flocks of German fighters."
26,"Post war Japan is at its lowest point when a new crisis emerges in the form of a giant monster, baptized in the horrific power of the atomic bomb."
27,"Delhi Police Officer Kabir Malik battles an insidious adversary, Zarar, who has chosen the path of terrorism. The show unfolds a thrilling chase, capturing the relentless pursuit of justice and the sacrifices made in the line of duty."
28,A highly trained group with colorful personalities investigate crimes that are connected to Navy and Marine Corps personnel.
29,"Monkey D. Luffy sets off on an adventure with his pirate crew in hopes of finding the greatest treasure ever, known as the ""One Piece."""
30,"When a man wakes up in the Australian outback with no memory, he must use the few clues he has to discover his identity before his past catches up with him."
31,"Vikings transports us to the brutal and mysterious world of Ragnar Lothbrok, a Viking warrior and farmer who yearns to explore--and raid--the distant shores across the ocean."
32,Aliens threaten human existence in an epic 26th-century showdown.
33,"After his hometown is destroyed and is traumatized, young Eren Jaeger vows to cleanse the earth of the giant humanoid Titans that have brought humanity to the brink of extinction."
34,A boy swallows a cursed talisman - the finger of a demon - and becomes cursed himself. He enters a shaman's school to be able to locate the demon's other body parts and thus exorcise himself.
35,"The story of firefighters and paramedics in the city of Chicago, both on a personal and professional level."
36,An adult animated series based on the Skybound/Image comic about a teenager whose father is the most powerful superhero on the planet.
37,An unusual group of robbers attempt to carry out the most perfect robbery in Spanish history - stealing 2.4 billion euros from the Royal Mint of Spain.
38,"Robert McCall finds himself at home in Southern Italy but he discovers his friends are under the control of local crime bosses. As events turn deadly, McCall knows what he has to do: become his friends' protector by taking on the mafia."
39,"Sebastian Klein, a renowned Klein family member, was rumored to be a loser after a prison stint. Natalie Quinn, unaware of the truth, married him, leading to a covert billionaire marriage."
40,"Driven by a dream of revenge against those who made her an outcast in Edo-period Japan, a young warrior cuts a bloody path toward her destiny."
41,"Exploring pivotal moments from the Marvel Cinematic Universe and turning them on their head, leading the audience into uncharted territory."
42,A noble family becomes embroiled in a war for control over the galaxy's most valuable asset while its heir becomes troubled by visions of a dark future.
43,"An elite special forces team tracking a deadly terrorist network, hell bent on blowing up Las Vegas."
44,"The fate of a violently contested kingdom hangs on the fraught bond between two friends-turned-foes in this saga of power, bloodshed and betrayal."
45,An imaginary place called Anjanadri where the protagonist gets the powers of Hanuman and fights for Anjanadri.
46,"Madame Web tells the standalone origin story of one of Marvel publishing's most enigmatic heroines. The suspense-driven thriller stars Dakota Johnson as Cassandra Webb, a paramedic in Manhattan who develops the power to see the future."
47,A former top assassin living incognito as a suburban dad must take his unsuspecting family on the run when his past catches up to him.
48,"When a sadistic serial killer begins murdering key political figures in Gotham, Batman is forced to investigate the city's hidden corruption and question his family's involvement."
49,"Geralt of Rivia, a solitary monster hunter, struggles to find his place in a world where people often prove more wicked than beasts."
50,"After thirty years, Maverick is still pushing the envelope as a top naval aviator, but must confront ghosts of his past when he leads TOP GUN's elite graduates on a mission that demands the ultimate sacrifice from those chosen to fly it."
51,"Miles Morales catapults across the multiverse, where he encounters a team of Spider-People charged with protecting its very existence. When the heroes clash on how to handle a new threat, Miles must redefine what it means to be a hero."
52,"Following the attack on the black site in Poland, Navy SEAL Jake Harris is ordered to escort terrorist suspect Amin Mansur to Washington D.C for interrogation."
53,"A blind lawyer by day, vigilante by night. Matt Murdock fights the crime of New York as Daredevil."
54,Archaeologist Indiana Jones races against time to retrieve a legendary artifact that can change the course of history.
55,Ethan Hunt and his IMF team must track down a dangerous weapon before it falls into the wrong hands.
56,"The travels of a lone bounty hunter in the outer reaches of the galaxy, far from the authority of the New Republic."
57,A middle-aged Chinese immigrant is swept up into an insane adventure in which she alone can save existence by exploring other universes and connecting with the lives she could have led.
58,"An American expat tries to sell off his highly profitable marijuana empire in London, triggering plots, schemes, bribery and blackmail in an attempt to steal his domain out from under him."
59,Paul Atreides unites with Chani and the Fremen while seeking revenge against the conspirators who destroyed his family.
60,"Follows Lucius, the son of Maximus' love Lucilla, after Maximus' death."
61,Dom Toretto and his family are targeted by the vengeful son of drug kingpin Hernan Reyes.
62,"Follows District 21 of the Chicago Police Department, made up of two different groups: the uniformed cops and the Intelligence Unit."
63,"Set in a high fantasy world where magic exists, but only some can access it, a woman named Moiraine crosses paths with five young men and women. This sparks a dangerous, world-spanning journey. Based on the book series by Robert Jordan."
64,"John Wick uncovers a path to defeating The High Table. But before he can earn his freedom, Wick must face off against a new enemy with powerful alliances across the globe and forces that turn old friends into foes."
65,A family of ducks try to convince their overprotective father to go on the vacation of a lifetime.
66,"After a fateful near-miss, an assassin battles his employers and himself, on an international manhunt he insists isn't personal."
67,"Low-level FBI agent Peter Sutherland works in the basement of the White House manning a phone that never rings - until the night it does, propelling him into a conspiracy that leads all the way to the Oval Office."
68,Katniss Everdeen voluntarily takes her younger sister's place in the Hunger Games: a televised competition in which two teenagers from each of the twelve Districts of Panem are chosen at random to fight to the death.
69,A former Roman General sets out to exact vengeance against the corrupt emperor who murdered his family and sent him into slavery.
70,"Wolverine joins the ""merc with a mouth"" in the third installment of the Deadpool film franchise."
71,"Tarzan, having acclimated to life in London, is called back to his former home in the jungle to investigate the activities at a mining encampment."
72,"From the world of ""The Boys"" comes ""Gen V,"" which explores the first generation of superheroes to know that their super powers are from Compound V. These heroes put their physical and moral boundaries to the test competing for the school's top ranking."
73,"When the menace known as the Joker wreaks havoc and chaos on the people of Gotham, Batman must accept one of the greatest psychological and physical tests of his ability to fight injustice."
74,"Up-and-coming CIA analyst, Jack Ryan, is thrust into dangerous field assignments."
75,"The Anti-Monitor (the Monitor's evil counterpart) is released in the DC Multiverse and begins to destroy the different Earths that compose it. The Monitor attempts to recruit heroes from across the Multiverse, but is murdered."
76,The mercurial villain Loki resumes his role as the God of Mischief in a new series that takes place after the events of “Avengers: Endgame.”
77,An ex-CIA agent is reactivated when an extortionist targets the agency.
78,A meek Hobbit from the Shire and eight companions set out on a journey to destroy the powerful One Ring and save Middle-earth from the Dark Lord Sauron.
79,"In a seafaring world, a young pirate captain sets out with his crew to attain the title of Pirate King, and to discover the mythical treasure known as 'One Piece.'"
80,"Set almost 100 years after Captain Kirk's 5-year mission, a new generation of Starfleet officers sets off in the U.S.S. Enterprise-D on its own mission to go where no one has gone before."
81,"Top IAF aviators come together in the face of imminent danger, to form Air Dragons. FIGHTER unfolds their camaraderie, brotherhood and battles, internal and external."
82,"Based on the unbelievable, inspiring true story of a team of underdogs - a struggling, working-class gamer, a failed former race car driver, and an idealistic motorsport exec - who risk it all to take on the most elite sport in the world."
83,"Follows Guntur Karam, the king of the underworld of Guntur city, as he falls in love with a journalist working to expose the illegal activities in the city."
84,"Epic drama set thousands of years before the events of J.R.R. Tolkien's 'The Hobbit' and 'The Lord of the Rings' follows an ensemble cast of characters, both familiar and new, as they confront the long-feared re-emergence of evil to Middle-earth."
85,"The lives of the elite Navy SEALs as they train, plan, and execute the most dangerous, high-stakes missions the United States of America can ask."
86,"The life of Spartacus, the gladiator who lead a rebellion against the Romans. From his time as an ally of the Romans, to his betrayal and becoming a gladiator, to the rebellion he leads and its ultimate outcome."
87,"A thief who steals corporate secrets through the use of dream-sharing technology is given the inverse task of planting an idea into the mind of a C.E.O., but his tragic past may doom the project and his team to disaster."
88,"Two ancient titans, Godzilla and Kong, clash in an epic battle as humans unravel their intertwined origins and connection to Skull Island's mysteries."
89,"As Alfred the Great defends his kingdom from Norse invaders, Uhtred--born a Saxon but raised by Vikings--seeks to claim his ancestral birthright."
90,"After the fall of the Galactic Empire, former Jedi Ahsoka Tano investigates an emerging threat to a vulnerable galaxy."
91,"In Spring 1945 in Gyeongseong, during Japanese rule over Korea, two young adults confront a strange creature born of greed, and battle against it for survival."
92,"Explores the high-pressure experiences of the first responders who are thrust into the most frightening, shocking, and heart-stopping situations."
93,A man who believes he has put his mysterious past behind him cannot stand idly by when he meets a young girl under the control of ultra-violent Russian gangsters.
94,"A prequel to Star Trek: The Original Series, the show follows the crew of the USS Enterprise under Captain Christopher Pike."
95,"Enforcing his own brand of justice, U.S. Marshal Raylan Givens, a strong-willed, quiet law-man haunted by his past, returns to his native town to see that justice is served to those in need."
96,"A young woman, destined to slay vampires, demons and other infernal creatures, deals with her life fighting evil, with the help of her friends."
97,"Determined to find out who killed his father, he will discover family secrets that will change his destiny forever."
98,"Molly, a high schooler, secretly earns her living as Angel, a street prostitute whose only family and friends are the ones she works with on the streets. She has to survive against a serial killer who is targeting people of her profession."
99,"An ex-con assumes the identity of a murdered sheriff in the small town of Banshee, Pennsylvania, where he has some unfinished business."
100,"A young Clark Kent struggles to find his place in the world as he learns to harness his alien powers for good and deals with the typical troubles of teenage life in Smallville, Kansas."
101,Plot kept under wraps.
102,"Live-action adaptation of the animated series centering on the adventures of Aang and his friends, who fight to save the world by defeating the Fire-Nation."
103,"Prequel series to Star Wars' 'Rogue One'. In an era filled with danger, deception and intrigue, Cassian will embark on the path that is destined to turn him into a Rebel hero."
104,"Barry Allen uses his super speed to change the past, but his attempt to save his family creates a world without super heroes, forcing him to race for his life in order to save the future."
105,A hit man from the Midwest moves to Los Angeles and gets caught up in the city's theatre arts scene.
106,"Still reeling from the loss of Gamora, Peter Quill rallies his team to defend the universe and one of their own - a mission that could mean the end of the Guardians if not successful."
107,"In a post-apocalyptic wasteland, a woman rebels against a tyrannical ruler in search for her homeland with the aid of a group of female prisoners, a psychotic worshiper and a drifter named Max."
108,"After being struck by lightning, Barry Allen wakes up from his coma to discover he's been given the power of super speed, becoming the Flash, and fighting crime in Central City."
109,"Decades after their 1984 All Valley Karate Tournament bout, a middle-aged Daniel LaRusso and Johnny Lawrence find themselves martial-arts rivals again."
110,"A charming thief and a band of unlikely adventurers embark on an epic quest to retrieve a lost relic, but things go dangerously awry when they run afoul of the wrong people."
111,"A structural engineer installs himself in a prison he helped design, in order to save his falsely accused brother from a death sentence by breaking themselves out from the inside."
112,The origin story of renegade warrior Furiosa before her encounter and teamup with Mad Max.
113,"With Spider-Man's identity now revealed, Peter asks Doctor Strange for help. When a spell goes wrong, dangerous foes from other worlds start to appear, forcing Peter to discover what it truly means to be Spider-Man."
114,An ex-hitman comes out of retirement to track down the gangsters who killed his dog and stole his car.
115,A group of high-end professional thieves start to feel the heat from the LAPD when they unknowingly leave a verbal clue at their latest heist.
116,"After his revenge on those who murdered his family, aimless Marine veteran Frank Castle finds a new meaning in life as a vigilante known as ""The Punisher""."
117,Five assassins aboard a swiftly-moving bullet train find out that their missions have something in common.
118,"In a version of 1985 where superheroes exist, the murder of a colleague sends active vigilante Rorschach on the trail of a conspiracy that will change the course of history."
119,"During the '90s, a new faction of Transformers - the Maximals - join the Autobots as allies in the battle for Earth."
120,"As students at the United States Navy's elite fighter weapons school compete to be best in the class, one daring young pilot learns a few things from a civilian instructor that are not taught in the classroom."
121,"Follows a young Viking as he aspires to hunt dragons, and how he becomes unexpectedly a friend of a young dragon."
122,"During the war in Afghanistan, a local interpreter risks his own life to carry an injured sergeant across miles of grueling terrain."
123,"CIA operative Joe attempts to balance her personal and professional life as the tip of the spear in the agency's war on terror. She enlists Cruz, a female special operations Marine, as an undercover member of the Lioness Program."
124,Follows a locally born and bred S.W.A.T. sergeant and his team of highly-trained men and women as they solve crimes in Los Angeles.
125,"Jake Sully lives with his newfound family formed on the extrasolar moon Pandora. Once a familiar threat returns to finish what was previously started, Jake must work with Neytiri and the army of the Na'vi race to protect their home."
126,"An action drama in which a niece who lost her parents and grew up in the hands of an uncle who runs a shopping mall, faces a new truth after her uncle's sudden death."
127,"A secret military team, SG-1, is formed to explore other planets through the recently discovered Stargates."
128,Tiger and Zoya are back - to save the country and their family. This time it's personal.
129,"Set in Utopian Piltover and the oppressed underground of Zaun, the story follows the origins of two iconic League Of Legends champions and the power that will tear them apart."
130,Katniss Everdeen and Peeta Mellark become targets of the Capitol after their victory in the 74th Hunger Games sparks a rebellion in the Districts of Panem.
131,"Biochemist Michael Morbius tries to cure himself of a rare blood disease, but he inadvertently infects himself with a form of vampirism instead."
132,"An ex-CIA agent and a wealthy programmer save lives via a surveillance AI that sends them the identities of civilians involved in impending crimes. However, the details of the crimes, including the civilians' roles, are left a mystery."
133,"A family is attacked by demons and only two members survive - Tanjiro and his sister Nezuko, who is turning into a demon slowly. Tanjiro sets out to become a demon slayer to avenge his family and cure his sister."
134,"Armed with every weapon they can get their hands on, the Expendables are the world's last line of defense and the team that gets called when all other options are off the table."
135,Procedural drama about the inner workings of the New York office of the Federal Bureau of Investigation.
136,"In the vicinity of the liberated planet of Bajor, the Federation space station Deep Space Nine guards the opening of a stable wormhole to the far side of the galaxy."
137,"In the 23rd Century, Captain James T. Kirk and the crew of the U.S.S. Enterprise explore the galaxy and defend the United Federation of Planets."
138,"Eight years after the Joker's reign of chaos, Batman is coerced out of exile with the assistance of the mysterious Selina Kyle in order to defend Gotham City from the vicious guerrilla terrorist Bane."
139,"Series based on the Marvel Comics superhero Hawkeye, centering on the adventures of Young Avenger, Kate Bishop, who took on the role after the original Avenger, Clint Barton."
140,A pragmatic paleontologist touring an almost complete theme park on an island in Central America is tasked with protecting a couple of kids after a power failure causes the park's cloned dinosaurs to run loose.
141,"Young Blade Runner K's discovery of a long-buried secret leads him to track down former Blade Runner Rick Deckard, who's been missing for thirty years."
142,"When Steve McGarrett returns home to Oahu to find his father's killer, the Governor offers him the chance to run his own task force: Five-0."
143,"When a beautiful stranger leads computer hacker Neo to a forbidding underworld, he discovers the shocking truth--the life he knows is the elaborate deception of an evil cyber-intelligence."
144,"12-year-old Mathilda is reluctantly taken in by Léon, a professional assassin, after her family is murdered. An unusual relationship forms as she becomes his protégée and learns the assassin's trade."
145,"Set in 1930s-1940s in British India and follows an outlaw called miller who engages in bloody loots, heists and assaults."
146,"The untold story behind Helm's Deep, hundreds of years before the fateful war, telling the life and bloodsoaked times of its founder, Helm Hammerhand, the King of Rohan."
147,"After outrunning a typhoon at sea, a strong-willed tugboat navigator and her crew discover a high-tech alien life form that's taken control of a Russian research vessel and aims to destroy on a massive scale."
148,The year is 1717. Wealthy land-owner Stede Bonnet has a midlife crisis and decides to blow up his cushy life to become a pirate. It does not go well. Based on a true story.
149,"In the near future, a team of journalists travel across the United States during a rapidly escalating civil war that has engulfed the entire nation."
150,"Street-smart Nathan Drake is recruited by seasoned treasure hunter Victor ""Sully"" Sullivan to recover a fortune amassed by Ferdinand Magellan, and lost 500 years ago by the House of Moncada."
151,"After witnessing his parents' death, Bruce learns the art of fighting to confront injustice. When he returns to Gotham as Batman, he must stop a secret society that intends to destroy the city."
152,"Ten years before Kirk, Spock, and the Enterprise, the USS Discovery discovers new worlds and lifeforms as one Starfleet officer learns to understand all things alien."
153,Gandalf and Aragorn lead the World of Men against Sauron's army to draw his gaze from Frodo and Sam as they approach Mount Doom with the One Ring.
154,Characters from different backgrounds are thrown together when the plane they're travelling on crashes into the Pacific Ocean. A nightmare fight for survival ensues with the air supply running out and dangers creeping in from all sides.
