,fantasy
0,Demigod Percy Jackson leads a quest across America to prevent a war among the Olympian gods.
1,"Nine noble families fight for control over the lands of Westeros, while an ancient enemy returns after being dormant for a millennia."
2,"In an attempt to find a non-violent alternative for reducing Hell's overpopulation, the daughter of Lucifer opens a rehabilitation hotel that offers a group of misfit demons a chance at redemption."
3,"With dreams of opening a shop in a city renowned for its chocolate, a young and poor Willy Wonka discovers that the industry is run by a cartel of greedy chocolatiers."
4,"Barbie and Ken are having the time of their lives in the colorful and seemingly perfect world of Barbie Land. However, when they get a chance to go to the real world, they soon discover the joys and perils of living among humans."
5,"When a peaceful settlement on the edge of a distant moon finds itself threatened by the armies of a tyrannical ruling force, a mysterious stranger living among its villagers becomes their best hope for survival."
6,"Carol Danvers gets her powers entangled with those of Kamala Khan and Monica Rambeau, forcing them to work together to save the universe."
7,"Black Manta seeks revenge on Aquaman for his father's death. Wielding the Black Trident's power, he becomes a formidable foe. To defend Atlantis, Aquaman forges an alliance with his imprisoned brother. They must protect the kingdom."
8,"Two brothers follow their father's footsteps as hunters, fighting evil supernatural beings of many kinds, including monsters, demons, and gods that roam the earth."
9,"When a young boy vanishes, a small town uncovers a mystery involving secret experiments, terrifying supernatural forces and one strange little girl."
10,"In a world of gifted hunters and monsters, a weak hunter Sung Jinwoo gains extraordinary powers through a mysterious program, leading him to become one of the strongest hunters and conquering even the strongest dungeons."
11,"An internal succession war within House Targaryen at the height of its power, 172 years before the birth of Daenerys Targaryen."
12,"A screenwriter drawn back to his childhood home enters into a fledgling relationship with a mysterious neighbor as he then discovers his parents appear to be living just as they were on the day they died, 30 years before."
13,"A young boy named Mahito yearning for his mother ventures into a world shared by the living and the dead. There, death comes to an end, and life finds a new beginning."
14,"Monkey D. Luffy sets off on an adventure with his pirate crew in hopes of finding the greatest treasure ever, known as the ""One Piece."""
15,"After his hometown is destroyed and is traumatized, young Eren Jaeger vows to cleanse the earth of the giant humanoid Titans that have brought humanity to the brink of extinction."
16,A boy swallows a cursed talisman - the finger of a demon - and becomes cursed himself. He enters a shaman's school to be able to locate the demon's other body parts and thus exorcise himself.
17,An adult animated series based on the Skybound/Image comic about a teenager whose father is the most powerful superhero on the planet.
18,An imaginary place called Anjanadri where the protagonist gets the powers of Hanuman and fights for Anjanadri.
19,"Geralt of Rivia, a solitary monster hunter, struggles to find his place in a world where people often prove more wicked than beasts."
20,"Poppy discovers that Branch was once part of the boy band 'BroZone' with his brothers, Floyd, John Dory, Spruce and Clay. When Floyd is kidnapped, Branch and Poppy embark on a journey to reunite his two other brothers and rescue Floyd."
21,"Miles Morales catapults across the multiverse, where he encounters a team of Spider-People charged with protecting its very existence. When the heroes clash on how to handle a new threat, Miles must redefine what it means to be a hero."
22,"Claire Beauchamp Randall, a nurse in World War II, mysteriously goes back in time to Scotland in 1743. There, she meets a dashing Highland warrior and gets drawn into an epic rebellion."
23,"A blind lawyer by day, vigilante by night. Matt Murdock fights the crime of New York as Daredevil."
24,The survivors of a plane crash are forced to work together in order to survive on a seemingly deserted tropical island.
25,"The travels of a lone bounty hunter in the outer reaches of the galaxy, far from the authority of the New Republic."
26,A middle-aged Chinese immigrant is swept up into an insane adventure in which she alone can save existence by exploring other universes and connecting with the lives she could have led.
27,"Set in a high fantasy world where magic exists, but only some can access it, a woman named Moiraine crosses paths with five young men and women. This sparks a dangerous, world-spanning journey. Based on the book series by Robert Jordan."
28,"Facing hardships and contemplating suicide after a series of setbacks, a man is confronted by Death and tasked with experiencing death over and over again through 13 other lives to earn the chance to live."
29,A family of ducks try to convince their overprotective father to go on the vacation of a lifetime.
30,"The lives, loves, dangers and disasters in the town, Mystic Falls, Virginia. Creatures of unspeakable horror lurk beneath this town as a teenage girl is suddenly torn between two vampire brothers."
31,"An orphaned boy enrolls in a school of wizardry, where he learns the truth about himself, his family and the terrible evil that haunts the magical world."
32,"A plumber named Mario travels through an underground labyrinth with his brother Luigi, trying to save a captured princess."
33,"Tarzan, having acclimated to life in London, is called back to his former home in the jungle to investigate the activities at a mining encampment."
34,"Follows Wednesday Addams' years as a student, when she attempts to master her emerging psychic ability, thwart a killing spree, and solve the mystery that embroiled her parents."
35,"The Anti-Monitor (the Monitor's evil counterpart) is released in the DC Multiverse and begins to destroy the different Earths that compose it. The Monitor attempts to recruit heroes from across the Multiverse, but is murdered."
36,The mercurial villain Loki resumes his role as the God of Mischief in a new series that takes place after the events of “Avengers: Endgame.”
37,A meek Hobbit from the Shire and eight companions set out on a journey to destroy the powerful One Ring and save Middle-earth from the Dark Lord Sauron.
38,"In a seafaring world, a young pirate captain sets out with his crew to attain the title of Pirate King, and to discover the mythical treasure known as 'One Piece.'"
39,"Epic drama set thousands of years before the events of J.R.R. Tolkien's 'The Hobbit' and 'The Lord of the Rings' follows an ensemble cast of characters, both familiar and new, as they confront the long-feared re-emergence of evil to Middle-earth."
40,A look into the nightly lives of four vampires who have lived together on Staten Island for over a century.
41,Lucifer Morningstar has decided he's had enough of being the dutiful servant in Hell and decides to spend some time on Earth to better understand humanity. He settles in Los Angeles - the City of Angels.
42,"After the fall of the Galactic Empire, former Jedi Ahsoka Tano investigates an emerging threat to a vulnerable galaxy."
43,"It will follow the story of humanity's first contact with an alien civilization, seeing humanity being vulnerable to the same external threat."
44,A teenager discovers he's the descendant of a Greek god and sets out on an adventure to settle an on-going battle between the gods.
45,"A group of spirits restlessly squabble in an abandoned country house. To their despair, a young couple inherits the house with hopeful plans to renovate it into a luxury hotel."
46,"A young woman, destined to slay vampires, demons and other infernal creatures, deals with her life fighting evil, with the help of her friends."
47,A tribe of cats called the Jellicles must decide yearly which one will ascend to the Heaviside Layer and come back to a new Jellicle life.
48,A young girl named Asha wishes on a star and gets a more direct answer than she bargained for when a trouble-making star comes down from the sky to join her.
49,Plot kept under wraps.
50,"Live-action adaptation of the animated series centering on the adventures of Aang and his friends, who fight to save the world by defeating the Fire-Nation."
51,"Prequel series to Star Wars' 'Rogue One'. In an era filled with danger, deception and intrigue, Cassian will embark on the path that is destined to turn him into a Rebel hero."
52,"Barry Allen uses his super speed to change the past, but his attempt to save his family creates a world without super heroes, forcing him to race for his life in order to save the future."
53,"A charming thief and a band of unlikely adventurers embark on an epic quest to retrieve a lost relic, but things go dangerously awry when they run afoul of the wrong people."
54,"A pitiless demon becomes powerless after getting entangled with an icy heiress, who may hold the key to his lost abilities -- and his heart."
55,"With Spider-Man's identity now revealed, Peter asks Doctor Strange for help. When a spell goes wrong, dangerous foes from other worlds start to appear, forcing Peter to discover what it truly means to be Spider-Man."
56,"Telepathic waitress Sookie Stackhouse encounters a strange new supernatural world when she meets the mysterious Bill Compton, a southern Louisiana gentleman and vampire."
57,A young woman with a troubled past is drawn to a small town in Maine where fairy tales are to be believed.
58,"Three Halliwell sisters discover that they are descendants of a line of good female witches and are destined to fight against the forces of evil, using their combined power of witchcraft known as the ""Power of Three""."
59,"A gothic tale of obsession between a haunted young woman and the terrifying vampire infatuated with her, causing untold horror in its wake."
60,"When the discovery of an ancient artifact unleashes an evil force, Ghostbusters new and old must join forces to protect their home and save the world from a second ice age."
61,"Follows a young Viking as he aspires to hunt dragons, and how he becomes unexpectedly a friend of a young dragon."
62,"Jake Sully lives with his newfound family formed on the extrasolar moon Pandora. Once a familiar threat returns to finish what was previously started, Jake must work with Neytiri and the army of the Na'vi race to protect their home."
63,"A young couple, Sam and Jay, inherit a haunted mansion and, unaware of their invisible housemates, plan to turn it into a B&B. Their lives become much more complicated after a fall causes Sam to see the ghosts. Based on the UK series."
64,"Set in Utopian Piltover and the oppressed underground of Zaun, the story follows the origins of two iconic League Of Legends champions and the power that will tear them apart."
65,"Follows Ember and Wade, in a city where fire-, water-, earth- and air-residents live together."
66,"In a parallel modern-day Stone Age world, a working-class family, the Flintstones, are set up for an executive job. But they learn that money can't buy happiness."
67,"A family is attacked by demons and only two members survive - Tanjiro and his sister Nezuko, who is turning into a demon slowly. Tanjiro sets out to become a demon slayer to avenge his family and cure his sister."
68,"A young boy wins a tour through the most magnificent chocolate factory in the world, led by the world's most unusual candy maker."
69,"A story about Ji-won, a time-limited woman, returning back to 10 years ago and dreaming of revenge after being killed by her husband who had an affair with her best friend."
70,A poor but hopeful boy seeks one of the five coveted golden tickets that will send him on a tour of Willy Wonka's mysterious chocolate factory.
71,"Three years after the disappearance of 2% of the global human population, a group of people in a small New York community try to continue their lives while coping with the tragedy of the unexplained nature of the event."
72,"Having gone missing seven years ago, the previously blind Prairie returns home, now in her twenties with her sight restored. While many believe she is a miracle, others worry that she could be dangerous."
73,"The untold story behind Helm's Deep, hundreds of years before the fateful war, telling the life and bloodsoaked times of its founder, Helm Hammerhand, the King of Rohan."
74,Gandalf and Aragorn lead the World of Men against Sauron's army to draw his gaze from Frodo and Sam as they approach Mount Doom with the One Ring.
75,"Arthur Curry, the human-born heir to the underwater kingdom of Atlantis, goes on a quest to prevent a war between the worlds of ocean and land."
76,"A family of former child heroes, now grown apart, must reunite to continue to protect the world."
77,"During her family's move to the suburbs, a sullen 10-year-old girl wanders into a world ruled by gods, witches and spirits, a world where humans are changed into beasts."
78,"When Bella Swan moves to a small town in the Pacific Northwest, she falls in love with Edward Cullen, a mysterious classmate who reveals himself to be a 108-year-old vampire."
79,"In a war-torn world of elemental magic, a young boy reawakens to undertake a dangerous mystic quest to fulfill his destiny as the Avatar, and bring peace to the world."
80,"Harry Potter finds himself competing in a hazardous tournament between rival schools of magic, but he is distracted by recurring nightmares."
81,A homicide detective discovers he is a descendant of hunters who fight supernatural forces.
82,"After the Vietnam war, a team of scientists explores an uncharted island in the Pacific, venturing into the domain of the mighty Kong and must fight to escape a primal Eden."
83,A small UK town named Sanctuary is shaken by murder accusations after a boy is discovered dead from an accident.
84,"Ordinary people find themselves in extraordinarily astounding situations, which they each try to solve in a remarkable manner."
85,"In a magically realistic version of Toronto, a young man must defeat his new girlfriend's seven evil exes one by one in order to win her heart."
86,"Following an explosion at a factory that mysteriously freezes a town in time, two students encounter a mysterious feral child, spurring an impulse of love fueled by the frustration of their daily lives that begins to upend their world."
87,Plot under wraps
88,"After Po is tapped to become the Spiritual Leader of the Valley of Peace, he needs to find and train a new Dragon Warrior, while a wicked sorceress plans to re-summon all the master villains whom Po has vanquished to the spirit realm."
89,"A collection of animated short stories that span various genres including science fiction, fantasy, horror and comedy."
90,A young mermaid makes a deal with a sea witch to trade her beautiful voice for human legs so she can discover the world above water and impress a prince.
91,"Harry, Ron, and Hermione search for Voldemort's remaining Horcruxes in their effort to destroy the Dark Lord as the final battle rages on at Hogwarts."
92,Four kids travel through a wardrobe to the land of Narnia and learn of their destiny to free it with the guidance of a mystical lion.
93,"Blacksmith Will Turner teams up with eccentric pirate ""Captain"" Jack Sparrow to save his love, the governor's daughter, from Jack's former pirate allies, who are now undead."
94,The film follows the Turtle brothers as they work to earn the love of New York City while facing down an army of mutants.
95,"Now exiled from Heaven and Hell, Aziraphale and Crowley must team up once again after the mysterious arrival of a familiar face."
96,A young Viking prince is on a quest to avenge his father's murder.
97,"Follows a motor-mouthed outsider offered a chance at a better life, but only if he can successfully deliver a mysterious package across a post-apocalyptic wasteland."
98,Professor Albus Dumbledore must assist Newt Scamander and his partners as Grindelwald begins to lead an army to eliminate all Muggles.
99,"A bedridden boy's grandfather reads him the story of a farmboy-turned-pirate who encounters numerous obstacles, enemies and allies in his quest to be reunited with his true love."
100,"Maddie, a teen stuck in the afterlife investigating her own disappearance, goes on a crime-solving mission as she adjusts to high-school purgatory."
101,Earth is visited by an alien species that threatens humanity's existence. Events unfold in real time through the eyes of five ordinary people across the globe as they struggle to make sense of the chaos unraveling around them.
102,"A reluctant Hobbit, Bilbo Baggins, sets out to the Lonely Mountain with a spirited group of dwarves to reclaim their mountain home, and the gold within it from the dragon Smaug."
103,"Luke Skywalker joins forces with a Jedi Knight, a cocky pilot, a Wookiee and two droids to save the galaxy from the Empire's world-destroying battle station, while also attempting to rescue Princess Leia from the mysterious Darth Vader."
104,"Dick and Rachel, a girl possessed by a strange darkness, get embroiled in a conspiracy that could bring Hell on Earth. Joining them along the way are the hot-headed Starfire and lovable Beast Boy. Together they become a team of heroes."
105,"This is a follow-up to the comedy Beetlejuice (1988), about a ghost who's recruited to help haunt a house."
106,"At an archaeological dig in the ancient city of Hamunaptra, an American serving in the French Foreign Legion accidentally awakens a mummy who begins to wreak havoc as he searches for the reincarnation of his long-lost love."
107,"The malevolent Ender Dragon sets out on a path of destruction, prompting a young girl and her group of unlikely adventurers to set out to save the Overworld."
108,"While Frodo and Sam edge closer to Mordor with the help of the shifty Gollum, the divided fellowship makes a stand against Sauron's new ally, Saruman, and his hordes of Isengard."
109,A secret government agency recruits some of the most dangerous incarcerated super-villains to form a defensive task force. Their first mission: save the world from the apocalypse.
110,"When Guy, a bank teller, learns that he is a non-player character in a bloodthirsty, open-world video game, he goes on to become the hero of the story and takes the responsibility of saving the world."
111,"A former warrior, now turned monk, tells the story of how Arthur became the lord of war despite the illegitimacy of his throne."
112,"An elf and her friends defeat a demon king in a great war. But the war is over, and the elf must search for a new way of life."
113,"A hapless young Viking who aspires to hunt dragons becomes the unlikely friend of a young dragon himself, and learns there may be more to the creatures than he assumed."
114,"Harry Potter, Ron and Hermione return to Hogwarts School of Witchcraft and Wizardry for their third year of study, where they delve into the mystery surrounding an escaped prisoner who poses a dangerous threat to the young wizard."
115,A family of power-hungry thousand-year-old vampires look to take back the city that they built and dominate all those who have done them wrong.
116,"The saga of the Eternals, a race of immortal beings who lived on Earth and shaped its history and civilizations."
117,Follows the personal and professional life of lawyer Ally.
118,A paraplegic Marine dispatched to the moon Pandora on a unique mission becomes torn between following his orders and protecting the world he feels is his home.
119,Teen Miles Morales becomes the Spider-Man of his universe and must join with five spider-powered individuals from other dimensions to stop a threat for all realities.
120,Plot under wraps
121,"Following the events of 'The Batman,' Oswald Cobblepot, aka The Penguin, makes a play to grab the reigns of the crime world in Gotham."
122,"Set in a world where love is deemed illegal and can be eradicated with a special procedure. With 95 days to go until her scheduled treatment, Lena Holoway does the unthinkable: she falls in love."
123,"In Hell, imp Blitzø runs an assassin business targeting the world of the living, using a spell book borrowed from a prince of Hell. With employees Moxxie, Millie, and Loona, they attempt to survive each other while keeping business afloat."
124,An ancient prophecy seems to be coming true when a mysterious presence begins stalking the corridors of a school of magic and leaving its victims paralyzed.
125,"When a single mom and her two kids arrive in a small town, they begin to discover their connection to the original Ghostbusters and the secret legacy their grandfather left behind."
126,"When an unconfident young woman is cursed with an old body by a spiteful witch, her only chance of breaking the spell lies with a self-indulgent yet insecure young wizard and his companions in his legged, walking castle."
127,"Upon escaping after decades of imprisonment by a mortal wizard, Dream, the personification of dreams, sets about to reclaim his lost equipment."
128,Four people and their otherworldly frienemy struggle in the afterlife to define what it means to be good.
129,"After landing the gig of a lifetime, a New York jazz pianist suddenly finds himself trapped in a strange land between Earth and the afterlife."
130,Common people discover that they have super powers. Their lives intertwine as a devastating event must be prevented.
131,"A tale set on death row, where gentle giant John Coffee possesses the mysterious power to heal people's ailments. When the lead guard, Paul Edgecombe, recognizes John's gift, he tries to help stave off the condemned man's execution."
132,Jedi Knights lead the Grand Army of the Republic against the droid army of the Separatists.
133,"Follow Riley, in her teenage years, encountering new emotions."
134,A rat who can cook makes an unusual alliance with a young kitchen worker at a famous Paris restaurant.
135,Two lighthouse keepers try to maintain their sanity while living on a remote and mysterious New England island in the 1890s.
136,"The misadventures of a talking sea sponge who works at a fast food restaurant, attends a boating school, and lives in an underwater pineapple."
137,"Hyun, a loner high school student who lost his entire family in a terrible accident, is forced to leave his home and has to face a new reality where monsters are trying to wipe out all of humanity. Now he must fight against all odds to try and race against the clock to save what is left of the human race before it's too late."
138,"In ancient Polynesia, when a terrible curse incurred by the demigod Maui reaches Moana's island, she answers the Ocean's call to seek out Maui to set things right."
139,"Three parapsychologists forced out of their university funding set up shop as a unique ghost removal service in New York City, attracting frightened yet skeptical customers."
140,"Imprisoned on the planet Sakaar, Thor must race against time to return to Asgard and stop Ragnarök, the destruction of his world, at the hands of the powerful and ruthless villain Hela."
141,"As Harry, Ron and Hermione race against time and evil to destroy the Horcruxes, they uncover the existence of the three most powerful objects in the wizarding world: the Deathly Hallows."
142,"Two Jedi escape a hostile blockade to find allies and come across a young boy who may bring balance to the Force, but the long dormant Sith resurface to claim their original glory."
143,"With their warning about Lord Voldemort's return scoffed at, Harry and Dumbledore are targeted by the Wizard authorities as an authoritarian bureaucrat slowly seizes power at Hogwarts."
144,"A family in 1630s New England is torn apart by the forces of witchcraft, black magic and possession."
145,Dark forces conspire against orphan mapmaker Alina Starkov when she unleashes an extraordinary power that could change the fate of her war-torn world.
146,"Return to the Faerun in a tale of fellowship and betrayal, and the lure of absolute power. Mysterious abilities are awakening inside you. Resist, and turn darkness against itself. Or embrace corruption, and become ultimate evil."
147,A Colombian teenage girl has to face the frustration of being the only member of her family without magical powers.
148,"Gon Freecss aspires to become a Hunter, an exceptional being capable of greatness. With his friends and his potential, he seeks out his father, who left him when he was younger."
149,An average high school student and his best friend get caught up in some trouble causing him to receive a werewolf bite. As a result they find themselves in the middle of all sorts of dramas in Beacon Hills.
150,"When the newly crowned Queen Elsa accidentally uses her power to turn things into ice to curse her home in infinite winter, her sister Anna teams up with a mountain man, his playful reindeer, and a snowman to change the weather condition."
151,"A teenager dies while saving a young kid and is given a chance to be resurrected, provided he works for the Spirit World as an investigator of supernatural crimes with his newly-given powers."
152,A fantasy retelling of the medieval story of Sir Gawain and the Green Knight.
153,"Hope Mikaelson, a tribrid daughter of a Vampire/Werewolf hybrid, makes her way in the world."
154,"Perseus, a demigod and the son of Zeus, battles the minions of Hades and the Underworld in order to stop them from conquering Olympus and Earth."
155,"An isolated island community experiences miraculous events - and frightening omens - after the arrival of a charismatic, mysterious young priest."
