,fantasy
462,"Six Los Angeles celebrities are stuck in James Franco's house after a series of devastating events just destroyed the city. Inside, the group not only have to face the apocalypse, but themselves."
463,"Jim Hawkins is a teenager who finds the map of a great treasure hidden by a space pirate. Together with some friends, he sets off in a large spaceship, shaped like a caravel, on his quest."
464,"A cooler-than-ever Bruce Wayne must deal with the usual suspects as they plan to rule Gotham City, while discovering that he has accidentally adopted a teenage orphan who wishes to become his sidekick."
465,The heroic warrior He-Man battles against the evil lord Skeletor and his armies of darkness for control of Castle Grayskull.
466,"The Darling family children receive a visit from Peter Pan, who takes them to Never Never Land where an ongoing war with the evil Pirate Captain Hook is taking place."
467,"A young witch, on her mandatory year of independent life, finds fitting into a new community difficult while she supports herself by running an air courier service."
468,A mermaid princess makes a Faustian bargain in an attempt to become human and win a prince's love.
469,"When aliens misinterpret video feeds of classic arcade games as a declaration of war, they attack the Earth in the form of the video games."
470,"Two 12-year-olds, who live on an island, fall in love with each other and elope into the wilderness. While people set out on a search mission, a violent storm approaching them catches their attention."
471,"An American drug dealer living in Tokyo is betrayed by his best friend and killed in a drug deal. His soul, observing the repercussions of his death, seeks resurrection."
472,A whiny news reporter is given the chance to step into God's shoes.
473,"A young man who survives a disaster at sea is hurtled into an epic journey of adventure and discovery. While cast away, he forms an unexpected connection with another survivor: a fearsome Bengal tiger."
474,"On Christmas Eve, a young boy embarks on a magical adventure to the North Pole on the Polar Express, while learning about friendship, bravery, and the spirit of Christmas."
475,"Cid Kagenou creates an elaborate plot to fight the Cult of Diabolos and builds his organization, the Shadow Garden."
476,"A teenage boy and girl get their lives changed forever when a California wildfire awakens a terrifying supernatural creature. As the full moon rises, all teens come together to unravel the secret that connects them."
477,"An ambitious young executive is sent to retrieve his company's CEO from an idyllic but mysterious ""wellness center"" at a remote location in the Swiss Alps, but soon suspects that the spa's treatments are not what they seem."
478,"When Woody is stolen by a toy collector, Buzz and his friends set out on a rescue mission to save Woody before he becomes a museum toy property with his roundup gang Jessie, Prospector, and Bullseye."
479,Ichabod Crane is resurrected and pulled two and a half centuries through time to unravel a mystery that dates all the way back to the founding fathers.
480,"Based on the stories of Stephen King, the series intertwines characters and themes from the fictional town of Castle Rock."
481,The legendary Greek hero leads a team of intrepid adventurers in a perilous quest for the legendary Golden Fleece.
482,"The prequel to Jujutsu Kaisen (2020), where a high schooler gains control of an extremely powerful cursed spirit and gets enrolled in the Tokyo Prefectural Jujutsu High School by Jujutsu Sorcerers."
483,"A man who specialises in debunking paranormal occurrences checks into the fabled room 1408 in the Dolphin Hotel. Soon after settling in, he confronts genuine terror."
484,"A vengeful fairy is driven to curse an infant princess, only to discover that the child could be the one person who can restore peace to their troubled land."
485,"A secret military project endangers Neo-Tokyo when it turns a biker gang member into a rampaging psychic psychopath who can only be stopped by a teenager, his gang of biker friends and a group of psychics."
486,"Lucy and Edmund Pevensie return to Narnia with their cousin Eustace where they meet up with Prince Caspian for a trip across the sea aboard the royal ship The Dawn Treader. Along the way they encounter dragons, dwarves, merfolk, and a band of lost warriors before reaching the edge of the world."
487,"Vanessa Helsing, distant relative of famous vampire hunter Abraham Van Helsing, is resurrected only to find that vampires have taken over the world."
488,"In 1931 Paris, an orphan living in the walls of a train station gets wrapped up in a mystery involving his late father and an automaton."
489,The curtain is pulled back on the millennia-old battle between the organizations of good luck and bad luck that secretly affects everyday lives.
490,"Iowa farmer Ray Kinsella is inspired by a voice he can't ignore to pursue a dream he can hardly believe. Supported by his wife, Ray begins the quest by turning his ordinary cornfield into a place where dreams can come true."
491,"A worker in a foreign finance company is bullied and worked around the clock, before a zombie outbreak finally makes him feel alive."
492,"A newcomer to a Catholic prep high school falls in with a trio of outcast teenage girls who practice witchcraft, and they all soon conjure up various spells and curses against those who anger them."
493,"A young man, Aren, is recruited into a secret society of magical Black people who dedicate their lives to a cause of utmost importance: making white people's lives easier."
494,"A five-year-old boy develops a relationship with Ponyo, a young goldfish princess who longs to become a human after falling in love with him."
495,A boy haunted by visions of a dark tower from a parallel reality teams up with the tower's disillusioned guardian to stop an evil warlock known as the Man in Black who plans to use the boy to destroy the tower and open the gates of Hell.
496,"A young maiden in a land called Andalasia, who is prepared to be wed, is sent away to New York City by an evil Queen, where she falls in love with a lawyer."
497,"An ordinary LEGO construction worker, thought to be the prophesied as ""special"", is recruited to join a quest to stop an evil tyrant from gluing the LEGO universe into eternal stasis."
498,"To keep her ailing father from serving in the Imperial Army, a fearless young woman disguises herself as a man and battles northern invaders in China."
499,A young man is reunited with a mermaid he briefly encountered as a boy and falls in love with her without knowing her secret.
500,Elena navigates her life between the human world and the werewolf world as the only female of the species.
501,"In the 41st century, an astronaut partakes in sexy misadventures while seeking to stop an evil scientist who threatens to bring evil back into the galaxy."
502,Perseus must battle Medusa and the Kraken to save the Princess Andromeda.
503,A witch tasks a childless baker and his wife with procuring magical items from classic fairy tales to reverse the curse put on their family tree.
504,"A grumpy ghost named Scratch is eternally cursed to be in the presence of polar opposite Molly McGee, a cheerful tween."
505,Brother/sister duo Hansel and Gretel are professional witch-hunters who help innocent villagers. One day they stumble upon a case that could hold the key to their past.
506,"Follows Orion, a young boy who is afraid of heights, pets, and rendered nearly catatonic by the worst of all perils: the dark. The Dark takes Orion on a nighttime trip to prove to the youngster that the only thing to fear is fear itself."
507,"When her mother disappears, Clary Fray learns that she descends from a line of warriors who protect our world from demons. She joins forces with others like her and heads into a dangerous alternate New York called the Shadow World."
508,A local scientist is often regarded as a failure until he invents a machine that can make food fall from the sky. But little does he know that things are about to take a turn for the worst.
509,"With the help of a magic ticket, a young movie fan is transported into the fictional world of his favorite action movie character."
510,"In a world where mutated humans are treated with distrust and fear, an institute for mutants battles to achieve peaceful co-existence with humanity."
511,"A spoof on previous years' epic movies (The Da Vinci Code (2006), The Chronicles of Narnia: The Lion, the Witch and the Wardrobe (2005) + 20 more), TV series, music videos and celebs. 4 orphans are on an epic adventure."
512,The life of a twelve-year-old boy who happens to be a blue cat as he lives with his family and other strange creatures.
513,"Set after the events in Terminator 2: Judgment Day (1991), Sarah Connor and her son, John, try to stay under-the-radar from the government, as they plot to destroy the computer network, Skynet, in hopes of preventing Armageddon."
514,"Continuing his ""legendary adventures of awesomeness"", Po must face two hugely epic, but different threats: one supernatural and the other a little closer to home."
515,A physician who can talk to animals embarks on an adventure to find a legendary island with a young apprentice and a crew of strange pets.
516,A woman gets trapped in a crazy virtual world along with five other humans and are now subject to the whims of wacky AI and their own personal traumas.
517,"The prehistoric family the Croods are challenged by a rival family the Bettermans, who claim to be better and more evolved."
518,"Spider-Men, Peter Parker and Miles Morales, return for an exciting new adventure in the critically acclaimed Marvel's Spider-Man franchise."
519,Ichabod Crane is sent to Sleepy Hollow to investigate the decapitations of three people; the culprit is legendary apparition The Headless Horseman.
520,"A fearless blue-haired girl named Hilda leaves the forest to go to town and find new friends, great adventures, magic and mysterious creatures who might be dangerous."
521,A mythological story about a goddess who created the entire universe. The plot revolves around the consequences when humans build a temple for her first-born.
522,"A young artist gets stranded in an extensive, immaculate forest in western Ireland, where, after finding shelter, she becomes trapped alongside three strangers, stalked by mysterious creatures each night."
523,"When the Dark Elves attempt to plunge the universe into darkness, Thor must embark on a perilous and personal journey that will reunite him with doctor Jane Foster."
524,"During the French Revolution, vampire hunter prodigy Richter Belmont fights to uphold his family's legacy and prevent the rise of a ruthless, power-hungry vampire."
525,"A terrifying evil has emerged. The wolves howl once again, but only a Werewolf like Scott McCall, can gather both new allies and reunite trusted friends to fight back against what could be the most powerful and deadliest enemy."
526,"As an Orc horde invades the planet Azeroth using a magic portal, a few human heroes and dissenting Orcs must attempt to stop the true evil behind this war."
527,Teenage explorer Dora leads her friends on an adventure to save her parents and solve the mystery behind a lost city of gold.
528,"A look at the relationship between Mike Wazowski (Billy Crystal) and James P. ""Sully"" Sullivan (John Goodman) during their days at Monsters University, when they weren't necessarily the best of friends."
529,"Follows Franklin and Irene York, a couple who years ago discovered a chamber buried in their backyard which inexplicably leads to a strange, deserted planet."
530,A young boy and his grandmother have a run-in with a coven of witches and their leader.
531,"After a deadly plague kills most of the world's population, the remaining survivors split into two groups - one led by a benevolent elder and the other by a malevolent being - to face each other in a final battle between good and evil."
532,"Henry Spencer tries to survive his industrial environment, his angry girlfriend, and the unbearable screams of his newly born mutant child."
533,A shallow man falls in love with a 300-pound woman because of her inner beauty.
534,"Accidentally sent to the world of the Boiling Isles before a trip to summer camp, a teenage human named Luz longs to become a witch and is aided by rebellious Eda and pint-sized demon King."
535,A childless couple discovers a mysterious newborn on their farm in Iceland.
536,Gary is an emotional wreck and struggles to provide for his daughter since the death of his wife. Mary has a secret she can't bring herself to share with anyone. The universe brought these two together for a reason.
537,"Jack Skellington, king of Halloween Town, discovers Christmas Town, but his attempts to bring Christmas to his home causes confusion."
538,"Follow the adventures of Peter Pan, a boy who does not want to grow up, and how he recruits three siblings in London, and together they embark on a magical adventure on the enchanted island of Neverland."
539,"An attractive and popular teenager, who is mean-spirited toward others, finds herself in the body of an older man, and must find a way to get back to her original body."
540,"Alice is appointed to save her beloved Mad Hatter from deadly grief by travelling back to the past, but this means fatally harming Time himself, the noble clockwork man with the device needed to save the Hatter's family from the Red Queen."
541,"A fast-lane investment broker, offered the opportunity to see how the other half lives, wakes up to find that his sports car and girlfriend have become a mini-van and wife."
542,"Caught between the worlds of the supernatural and human, Hellboy battles an ancient sorceress bent on revenge."
543,"""Good Witch"" will take viewers on a new magical journey with Cassie Nightingale and her daughter Grace. When Dr. Sam Radford moves in next door to Grey House with his son, they are charmed by the 'magical' mother-daughter duo."
544,"An unpredictable fantasy romance between a woman living under a curse that causes her to turn into a dog when kissed, and the only one who can help her overcome the curse is a man who is afraid of dogs."
545,Three unknowing martial artists are summoned to a mysterious island to compete in a tournament whose outcome will decide the fate of the world.
546,"When Cyrus Kriticos, a very rich collector of unique things, dies, he leaves his house, fortune, and his prized collection of ghosts."
547,"A dutiful damsel agrees to marry a handsome prince, only to find the royal family has recruited her as a sacrifice to repay an ancient debt."
548,"An all-star ensemble of beloved characters from Walt Disney Animation Studios come together for a joyful, entertaining and emotional reunion as they assemble for a spectacular group photo to mark Disney's 100th anniversary."
549,The discovery of a massive river of ectoplasm and a resurgence of spectral activity allows the staff of Ghostbusters to revive the business.
550,Video game adventurer Lara Croft comes to life in a movie where she races against time and villains to recover powerful ancient artifacts.
551,The film is a fairy-tale comedy about a workaholic man who enlists the help of a magical genie to help win his family back before Christmas.
552,"Based on the New York Times bestseller, The Power is our world, but for one twist of nature. Suddenly, women develop a mysterious new ability to electrocute at will, leading to an extraordinary global reversal of the power balance"
553,"A cocky, chauvinistic advertising executive magically acquires the ability to hear what women are thinking."
554,"Elektra the warrior survives a near-death experience, becomes an assassin-for-hire, and tries to protect her two latest targets, a single father and his young daughter, from a group of supernatural assassins."
555,"A depressed musician reunites with his lover. However, their romance, which has already endured several centuries, is disrupted by the arrival of her uncontrollable younger sister."
556,"Princess Tiabeanie, 'Bean', is annoyed at her imminent arranged marriage to Prince Merkimer. Then she meets Luci, a demon, and Elfo, an elf, and things get rather exciting, and dangerous."
557,"A man named Farmer sets out to rescue his kidnapped wife and avenge the death of his son, two acts committed by the Krugs, a race of animal-warriors who are controlled by the evil Gallian."
558,A fortune teller with extrasensory perception is asked to help find a young woman who has mysteriously disappeared.
559,A supernatural medical drama that centers on the lives of the doctors and nurses of Hope Zion Hospital.
560,A caveman and a dinosaur bond over shared tragedy and work together to survive in a perilous prehistoric world.
561,"When the sun goes down on the last night of summer camp, nine teenage counselors are plunged into an unpredictable night of horror."
562,"Oskar, an overlooked and bullied boy, finds love and revenge through Eli, a beautiful but peculiar girl."
563,Vampire Count Orlok expresses interest in a new residence and real estate agent Hutter's wife.
564,"Two Brooklyn plumbers, Mario and Luigi, must travel to another dimension to rescue a princess from the evil dictator King Koopa and stop him from taking over the world."
565,"After being given a mysterious power to control others, an outcast prince becomes the masked leader of the rebellion against an all-powerful empire."
566,In the midst of the wedding princess Miroslava is kidnapped by a dragon and carried away into his castle on the remote island.
567,Serialized remake of 'The Princess Bride' told in short chapters featuring celebrities at home during quarantine.
568,"Six years after the events of ""Wreck-It Ralph,"" Ralph and Vanellope, now friends, discover a wi-fi router in their arcade, leading them into a new adventure."
569,"A 12-year-old boy searches for the one thing that will enable him to win the affection of the girl of his dreams. To find it he must discover the story of the Lorax, the grumpy yet charming creature who fights to protect his world."
570,"The Quileutes close in on expecting parents Edward and Bella, whose unborn child poses a threat to the Wolf Pack and the towns people of Forks."
571,"In London, two lowly interns at a mysterious firm uncover a plot by their CEO to disrupt the ancient magical world with modern corporate practices."
572,"Gloria is an out-of-work party girl forced to leave her life in New York City and move back home. When reports surface that a giant creature is destroying Seoul, she gradually comes to the realization that she is somehow connected to this phenomenon."
573,"A 34-year-old Japanese NEET is run over by a speeding truck and dies. Before he knows it, he is reborn as Rudeus Greyrat, and begins a new life full of adventure."
574,The peaceful town of Centerville finds itself battling a zombie horde as the dead start rising from their graves.
575,A group of elite warriors parachute into an unfamiliar jungle and are hunted by members of a merciless alien race.
576,"Exiled into the dangerous forest by her wicked stepmother, a princess is rescued by seven dwarf miners who make her part of their household."
577,"Duncan MacLeod is Immortal, and must live in modern society, concealing his true nature while fighting other Immortals."
578,"An updated version of the classic anthology series featuring various tales of science fiction, mystery, and horror."
579,The fictional Creepshow comic books come to life in this anthology series of terrifying tales hosted by the silent Creepshow ghoul.
580,"The warrior Beowulf must fight and defeat the monster Grendel, who is terrorizing Denmark, then Grendel's Mother, who begins killing out of revenge."
581,An urban dark fantasy drama about a gumiho who settles into the city and a producer who is after it.
582,The war for Eternia begins again in what may be the final battle between He-Man and Skeletor. A new animated series from writer-director Kevin Smith.
583,In 1969 a young Jud Crandall and his childhood friends band together to confront an ancient evil that has gripped their hometown of Ludlow.
584,A puppeteer discovers a portal that leads literally into the head of movie star John Malkovich.
585,"Araji Tomobishi gets caught up in battles among powerful individuals after reuniting with his former friend Mataka Asamine. Meanwhile, the shadow of a colossal demon appears...?!."
586,"A group of librarians set off on adventures in an effort to save mysterious, ancient artifacts."
587,An injured forest ranger on a routine mission is saved by two off-the-grid survivalists. What is initially a welcome rescue grows more suspicious as the son and his renegade father reveal a cultish devotion to the forest.
588,"Sean Anderson partners with his mom's husband on a mission to find his grandfather, who is thought to be missing on a mythical island."
589,"14th-century knights transport a suspected witch to a monastery, where monks deduce that her powers could be the source of the Black Plague."
590,"Po and his friends fight to stop a peacock villain from conquering China with a deadly new weapon, but first the Dragon Warrior must come to terms with his past."
591,A rag doll that awakens in a postapocalyptic future holds the key to humanity's salvation.
592,Two young brothers are drawn into an intergalactic adventure when their house is hurled through the depths of space by the magical board game they are playing.
593,"Dracula, who operates a high-end resort away from the human world, goes into overprotective mode when a boy discovers the resort and falls for the count's teenaged daughter."
594,"In his homeland of Alagaesia, a farm boy happens upon a dragon's egg -- a discovery that leads him on a predestined journey where he realizes he's the one person who can defend his home against an evil king."
595,Ryder and the pups are called to Adventure City to stop Mayor Humdinger from turning the bustling metropolis into a state of chaos.
596,"In the year 2022, thousands of people get trapped in a new virtual MMORPG and the lone wolf player, Kirito, works to escape."
597,A G.I. Joe spin-off centered around the character of Snake Eyes.
598,"After two of the devil's three sons escape Hell to wreak havoc on Earth, the devil must send his third son, the mild-mannered Nicky, to bring them back before it's too late."
599,"A young, recently-orphaned girl is sent to England after living in India all of her life. Once there, she begins to explore her new, seemingly-isolated surroundings, and its secrets."
600,"Set after the events of ""WandaVision,"" Agatha Harkness recruits some unlikely allies on her quest to regain her former powers."
601,"Homicide detective John Hobbes witnesses the execution of serial killer Edgar Reese. Soon after the execution, the killings start again, and they are very similar to Reese's style."
602,"A puppet is brought to life by a fairy, who assigns him to lead a virtuous life in order to become a real boy."
603,A young African-American travels across the U.S. in the 1950s in search of his missing father.
604,A young boy and a girl with a magic crystal must race against pirates and foreign agents in a search for a legendary floating castle.
605,"Six months after the defeat of Majin Buu, The mighty Saiyan Son Goku continues his quest on becoming stronger."
606,"In turn-of-the-century Vienna, a magician uses his abilities to secure the love of a woman far above his social standing."
607,"In 1920s Los Angeles, a bedridden patient in a hospital captivates a young girl with a fantastic tale of heroes, myths, and villains on a desert island."
608,"A spoof of 300 (2006) and many other movies, TV series/shows/commercials, video games and celebrities. King Leonidas of Sparta and his army of 12 go to war against Xerxes of Persia to fight to the death for Sparta's freedom."
609,Holistic detective Dirk Gently investigates cases involving the supernatural.
610,"After a tragic car accident that kills his wife, a man discovers he can communicate with the dead, and he uses that gift to con people. However, when a demonic spirit appears, he may be the only one who can stop it from killing the living and the dead."
611,"Two human princes forge an unlikely bond with the elfin assassin sent to kill them, embarking on an epic quest to bring peace to their warring lands."
612,"On a quest to find out what happened to his missing brother, a scientist, his nephew and their mountain guide discover a fantastic and dangerous lost world in the center of the earth."
613,"Having endured his legendary twelve labors, Hercules, the Greek demigod, has his life as a sword-for-hire tested when the King of Thrace and his daughter seek his aid in defeating a tyrannical warlord."
614,The adventures of the greatest of the female superheroes.
615,"Chris Nielsen dies in an accident, and enters Heaven. But when he discovers that his beloved wife Annie has killed herself out of grief over the loss, he embarks on an afterlife adventure to reunite with her."
616,"It follows Lucy as she's hired to write the script for a remake of a holiday movie. She joins a tour of the grounds and when she knocks an hourglass over, she finds herself transported back in time to 1946."
617,Star Wars series that takes viewers into a galaxy of shadowy secrets and emerging dark-side powers in the final days of the High Republic era.
618,A cupid from 500 years awaiting his release meets a woman born with no red thread of love for all her incarnations. What would happen when they take an interest in each other amidst a series of serial killings and a complicated past life?
