,fantasy
306,"With the help of the powerful Dragonballs, a team of fighters led by the saiyan warrior Goku defend the planet earth from extraterrestrial enemies."
307,A newly fostered young boy in search of his mother instead finds unexpected super powers and soon gains a powerful enemy.
308,"When a sixteen-year-old high school student finds out she's a witch, her two aunts offer guidance on how to control her newly-discovered magical powers."
309,A frustrated son tries to determine the fact from fiction in his dying father's life.
310,"The story of the Joestar family, who are possessed with intense psychic strength, and the adventures each member encounters throughout their lives."
311,"Set in a fictional country called Daeho, it is about the love and growth of young mages as they overcome their twisted fates due to a forbidden magic spell known as the ""alchemy of souls"", which allows souls to switch bodies."
312,"Following the events of Avengers: Endgame (2019), Spider-Man must step up to take on new threats in a world that has changed forever."
313,A vampire hunter fights to save a besieged city from an army of otherworldly creatures controlled by Dracula.
314,"Mortal hero Bek teams with the god Horus in an alliance against Set, the merciless god of darkness, who has usurped Egypt's throne, plunging the once peaceful and prosperous empire into chaos and conflict."
315,"Stuck in a time loop, two wedding guests develop a budding romance while living the same day over and over again."
316,"An imprisoned vampire, Barnabas Collins, is set free and returns to his ancestral home, where his dysfunctional descendants are in need of his protection."
317,"Reeves will reprise his role as supernatural exorcist and demonologist John Constantine. Who, in the original is dying, but sticks around to save his soul by keeping demons in hell from breaching earth."
318,A group of supervillains are recruited to go on missions for the government.
319,Androids are tasked with raising human children on a mysterious planet.
320,A boy who is half human and half deer survives in a post-apocalyptic world with other hybrids.
321,"Krypto the Super-Dog and Superman are inseparable best friends, sharing the same superpowers and fighting crime side by side in Metropolis. However, Krypto must master his own powers for a rescue mission when Superman is kidnapped."
322,"Robbed of his birthright, Arthur comes up the hard way in the back alleys of the city. But once he pulls the sword from the stone, he is forced to acknowledge his true legacy - whether he likes it or not."
323,Live-action adaptation of the 1937 Disney animated film 'Snow White and the Seven Dwarfs'.
324,Avatar Korra fights to keep Republic City safe from the evil forces of both the physical and spiritual worlds.
325,A young woman goes on a solo vacation to the English countryside following the death of her ex-husband.
326,"A down-on-his-luck inventor turns a broken-down Grand Prix car into a fancy vehicle for his children, and then they go off on a magical fantasy adventure to save their grandfather in a far-off land."
327,"In the Far East, Alex O'Connell, the son of famed mummy fighters Rick and Evy O'Connell, unearths the mummy of the first Emperor of Qin -- a shape-shifting entity cursed by a witch centuries ago."
328,"Jack Sparrow and Barbossa embark on a quest to find the elusive fountain of youth, only to discover that Blackbeard and his daughter are after it too."
329,"When a goddess of war reincarnates in the body of a young girl, street orphan Seiya discovers that he is destined to protect her and save the world. But only if he can face his own past and become a Knight of the Zodiac."
330,The quiet lives of three high school students with genetic superhuman abilities turn upside down when a mysterious organization starts to hunt them down one by one.
331,A mysterious viral outbreak with hallmarks of an ancient and evil strain of vampirism ravages the city of New York.
332,"On the outskirts of Whoville lives a green, revenge-seeking Grinch who plans to ruin Christmas for all of the citizens of the town."
333,"In a twist to the fairy tale, the Huntsman ordered to take Snow White into the woods to be killed winds up becoming her protector and mentor in a quest to vanquish the Evil Queen."
334,A modern action adventure road story where a 17-year-old girl named Suzume helps a mysterious young man close doors from the other side that are releasing disasters all over in Japan.
335,"Ash Ketchum, his yellow pet Pikachu, and his human friends explore a world of powerful creatures."
336,MMA fighter Cole Young seeks out Earth's greatest champions in order to stand against the enemies of Outworld in a high stakes battle for the universe.
337,"Captain Barbossa, Will Turner and Elizabeth Swann must sail off the edge of the map, navigate treachery and betrayal, find Jack Sparrow, and make their final alliances for one last decisive battle."
338,"When two girls move to the country to be near their ailing mother, they have adventures with the wondrous forest spirits who live nearby."
339,A couple on a backpacking trip discovers a magical town in which everyone acts like they're in a classic musical.
340,"Shrek and Fiona travel to the Kingdom of Far Far Away, where Fiona's parents are King and Queen, to celebrate their marriage. When they arrive, they find they are not as welcome as they thought they would be."
341,"A comedy set in the offices of Heaven Inc. When God plans to destroy the Earth, two low-level angels must convince their boss to save humanity. They bet him they can pull off their most impossible miracle yet: help two humans fall in love."
342,A huntress agrees to travel to a magical realm with a faerie lord in return for her family's safety.
343,The solitary life of an artificial man - who was incompletely constructed and has scissors for hands - is upended when he is taken in by a suburban family.
344,"After their father is murdered under mysterious circumstances, the three Locke siblings and their mother move into their ancestral home, Keyhouse, which they discover is full of magical keys that may be connected to their father's death."
345,Three girls become mermaids after a mysterious island transforms them and gives them special powers.
346,Realtor Luke Roman and an elite team of specialists handle the cases that no one else can: haunted and possessed houses that literally scare would-be buyers away.
347,"While Batman deals with a deformed man calling himself the Penguin wreaking havoc across Gotham with the help of a cruel businessman, a female employee of the latter becomes the Catwoman with her own vendetta."
348,"After her mother disappears, Clary must venture into the dark world of demon hunting, and embrace her new role among the Shadowhunters."
349,"Kora and surviving warriors prepare to defend Veldt, their new home, alongside its people against the Realm. The warriors face their pasts, revealing their motivations before the Realm's forces arrive to crush the growing rebellion."
350,"While on a trip to Paris with his fiancée's family, a nostalgic screenwriter finds himself mysteriously going back to the 1920s every day at midnight."
351,A workaholic architect finds a universal remote that allows him to fast-forward and rewind to different parts of his life. Complications arise when the remote starts to overrule his choices.
352,"Kamala, a superhero fan with an imagination--particularly when it comes to Captain Marvel--feels like she doesn't fit in at school and sometimes even at home, that is until she gets superpowers like the heroes she admires."
353,A witch married to an ordinary man cannot resist using her magic powers to solve the problems her family faces.
354,"To save her father from death in the army, a young maiden secretly goes in his place and becomes one of China's greatest heroines in the process."
355,The surreal misadventures of two best friends - a blue jay and a raccoon - as they seek to liven up their mundane jobs as groundskeepers at the local park.
356,A newly recruited night security guard at the Museum of Natural History discovers that an ancient curse causes the animals and exhibits on display to come to life and wreak havoc.
357,"""Sparkling Watermelon"" will tell the story of a boy living a double life between a model student and a band member who gets to time slip and meets his 18-year-old father. The two will build friendships there."
358,"An adventurous 11-year-old girl finds another world that is a strangely idealized version of her frustrating home, but it has sinister secrets."
359,A rough-and-tumble trucker and his side kick face off with an ancient sorcerer in a supernatural battle beneath Chinatown.
360,"When Hiccup and Toothless discover an ice cave that is home to hundreds of new wild dragons and the mysterious Dragon Rider, the two friends find themselves at the center of a battle to protect the peace."
361,"The peace is suddenly broken when warning sirens blare through the Soul Society. Residents are disappearing without a trace and nobody knows who's behind it. Meanwhile, a darkness is approaching Ichigo and his friends in Karakura Town."
362,"On the Italian Riviera, an unlikely but strong friendship grows between a human being and a sea monster disguised as a human."
363,"When Hiccup discovers Toothless isn't the only Night Fury, he must seek the Hidden World, a secret Dragon Utopia before a hired tyrant named Grimmel finds it first."
364,A prince cursed to spend his days as a hideous monster sets out to regain his humanity by earning a young woman's love.
365,A young girl institutionalized by her abusive stepfather retreats to an alternative reality as a coping strategy and envisions a plan to help her escape.
366,"As her 16th birthday nears, Sabrina Spellman must reconcile her dual nature as a half-witch, half-mortal while fighting the evil forces that threaten her, her family, and the daylight world humans inhabit."
367,"The enchanted lives of a couple in a secluded forest are brutally shattered by a nightmarish hippie cult and their demon-biker henchmen, propelling a man into a spiraling, surreal rampage of vengeance."
368,"Theseus is a mortal man chosen by Zeus to lead the fight against the ruthless King Hyperion, who is on a rampage across Greece to obtain a weapon that can destroy humanity."
369,The 'Bad Batch' of elite and experimental clones make their way through an ever-changing galaxy in the immediate aftermath of the Clone Wars.
370,"A dark force threatens Alpha, a vast metropolis and home to species from a thousand planets. Special operatives Valerian and Laureline must race to identify the marauding menace and safeguard not just Alpha, but the future of the universe."
371,"When a new toy called ""Forky"" joins Woody and the gang, a road trip alongside old and new friends reveals how big the world can be for a toy."
372,"When the power-hungry Ravan tore through the world to unleash evil, in his way stood a humble vaanar awoken to his divinity to become an immortal legend."
373,"Selene, a vampire warrior, is entrenched in a conflict between vampires and werewolves, while falling in love with Michael, a human who is sought by werewolves for unknown reasons."
374,"After a supernatural event at his church, a preacher enlists the help of a vampire and his ex to find God."
375,"After their cave is destroyed, a caveman family must trek through an unfamiliar fantastical world with the help of an inventive boy."
376,"Marinette and Adrien, two normal teens, transform into the superheroes Ladybug and Cat Noir when a mysterious evil threatens to destroy Paris."
377,"While on a journey of physical and spiritual healing, a brilliant neurosurgeon is drawn into the world of the mystic arts."
378,"Kratos and his son Atreus face the oncoming Norse apocalypse, Ragnarok."
379,"An adaptation of the Tony and Olivier award-winning musical. Matilda tells the story of an extraordinary girl who, armed with a sharp mind and a vivid imagination, dares to take a stand to change her story with miraculous results."
380,"In an alternate Victorian Age world, a group of famous contemporary fantasy, science fiction, and adventure characters team up on a secret mission."
381,Con artists plan to fleece an eccentric family using an accomplice who claims to be their long-lost uncle.
382,"Many in the coastal town of Haven, Maine have a dormant curse or ""trouble"" that could trigger at any time for any reason. FBI agent Audrey Parker, the sheriff and the town's black sheep must deal with the troubles' deadly effects."
383,"When a fading actress learns of an immortality treatment, she sees it as a way to outdo her long-time rival."
384,"After a young man is murdered, his spirit stays behind to warn his lover of impending danger, with the help of a reluctant psychic."
385,"A young woman, who can see and hear ghosts, tries to helps them resolve their issues and hopefully find peace."
386,"A vampire tells his epic life story: love, betrayal, loneliness, and hunger."
387,A group of young offenders doing community service gets struck by lightning during a storm and start to develop superpowers.
388,"A live-action adaptation of Nickelodeon's Winx Club (2004). It follows Bloom as she adjusts to life in the Otherworld, where she must learn to control her dangerous magical powers."
389,"Anna, Elsa, Kristoff, Olaf and Sven leave Arendelle to travel to an ancient, autumn-bound forest of an enchanted land. They set out to find the origin of Elsa's powers in order to save their kingdom."
390,"King Arthur and his Knights of the Round Table embark on a surreal, low-budget search for the Holy Grail, encountering many, very silly obstacles."
391,"Follows a flawed family of humans, gods, and monsters that tries to run one of the world's first cities without killing each other."
392,Suburban mom Allison DuBois attempts to balance family life with solving mysteries using her special gift. The dead send her visions of their deaths or other crimes while she sleeps.
393,Supernatural horror loosely based on Salem's 17th century witch trials.
394,"Diana must contend with a work colleague, and with a businessman whose desire for extreme wealth sends the world down a path of destruction, after an ancient artifact that grants wishes goes missing."
395,"A man struggles with memories of his past, which include a wife he cannot remember and a nightmarish world no one else ever seems to wake up from."
396,"A shy adolescent learns that she comes from a fabled royal family of legendary sea krakens and that her destiny lies in the depths of the waters, which is bigger than she could have ever imagined."
397,"Bound by a shared destiny, a teen bursting with scientific curiosity and a former boy-genius inventor embark on a mission to unearth the secrets of a place somewhere in time and space that exists in their collective memory."
398,"The Pevensie siblings return to Narnia, where they are enlisted to once again help ward off an evil king and restore the rightful heir to the land's throne, Prince Caspian."
399,Teela joins forces with He-Man and the other Masters in their quest to save Eternia from the grip of darkness.
400,"A father's wish magically brings a wooden boy to life in Italy, giving him a chance to care for the child."
401,A pathological liar-lawyer finds his career turned upside down when he inexplicably cannot physically lie for 24 whole hours.
402,"The last surviving child of the Russian Royal Family joins two con men to reunite with her grandmother, the Dowager Empress, while the undead Rasputin seeks her death."
403,Best friends Sophie and Agatha find themselves on opposing sides of an epic battle when they're swept away into an enchanted school where aspiring heroes and villains are trained to protect the balance between Good and Evil.
404,"A young and parentless girl adopts a 'dog' from the local pound, completely unaware that it's supposedly a dangerous scientific experiment that's taken refuge on Earth and is now hiding from its creator and those who see it as a menace."
405,An abortion clinic worker with a special heritage is called upon to save the existence of humanity from being negated by two renegade angels trying to exploit a loop-hole and reenter Heaven.
406,"The toys are mistakenly delivered to a day-care center instead of the attic right before Andy leaves for college, and it's up to Woody to convince the other toys that they weren't abandoned and to return home."
407,"Edward leaves Bella after an attack that nearly claimed her life, and, in her depression, she falls into yet another difficult relationship - this time with her close friend, Jacob Black."
408,"A group of five high schoolers unleash supernatural forces upon their town. Now, they must work together in order to save it."
409,"Hercules, aided by his best friend Iolaus, goes on many adventures helping people and slaying mythical monsters using his half-god strength."
410,"As a string of mysterious killings grips Seattle, Bella, whose high school graduation is fast approaching, is forced to choose between her love for vampire Edward and her friendship with werewolf Jacob."
411,A young man inadvertently breaks three important rules concerning his new pet and unleashes a horde of malevolently mischievous monsters on a small town.
412,"Dave is a married man with three kids and a loving wife, and Mitch is a single man who is at the prime of his sexual life. One fateful night while Mitch and Dave are peeing in a fountain, lightning strikes and they switch bodies."
413,A small Norwegian town experiencing warm winters and violent downpours seems to be headed for Ragnarok -- unless someone intervenes in time.
414,"A young artist, searching for his vocation, makes a mannequin so perfect he falls in love with it. Finding the mannequin in a store window, he gets a job there and his creation comes to life."
415,"In a world dominated by female superhumans, a young male is recruited into a squad of monster hunters."
416,"When a massive fire kills their parents, three children are delivered to the custody of cousin and stage actor Count Olaf, who is secretly plotting to steal their parents' vast fortune."
417,"Son of Naruto Uzumaki, Boruto, follows his father's footsteps along with his friends to become great ninja. Throughout all their adventures, Boruto is determined to make his mark in the ninja world and live outside of his father's shadow."
418,An impromptu goodbye party for Professor John Oldman becomes a mysterious interrogation after the retiring scholar reveals to his colleagues he has a longer and stranger past than they can imagine.
419,"The famed monster hunter is sent to Transylvania to stop Count Dracula, who is using Dr. Frankenstein's research and a werewolf for nefarious purposes."
420,Plot under wraps.
421,"Twenty-seven years after their first encounter with the terrifying Pennywise, the Losers Club have grown up and moved away, until a devastating phone call brings them back."
422,"A special bond develops between plus-sized inflatable robot Baymax and prodigy Hiro Hamada, who together team up with a group of friends to form a band of high-tech heroes."
423,"Raised as an oversized elf, Buddy travels from the North Pole to New York City to meet his biological father, Walter Hobbs, who doesn't know he exists and is in desperate need of some Christmas spirit."
424,"Set a few months after the events of the second season of Daredevil, and a month after the events of Iron Fist, the vigilantes Daredevil, Jessica Jones, Luke Cage, and Iron Fist team up in New York City to fight a common enemy: The Hand."
425,A young fugitive prince and princess must stop a villain who unknowingly threatens to destroy the world with a special dagger that enables the magic sand inside to reverse time.
426,"The mummified body of Imhotep is shipped to a museum in London, where he once again wakes and begins his campaign of rage and terror."
427,"An epic tale following a gang of Victorian women who find themselves with unusual abilities, relentless enemies, and a mission that might change the world."
428,"A lonely scholar, on a trip to Istanbul, discovers a Djinn who offers her three wishes in exchange for his freedom."
429,"Paddington, now happily settled with the Brown family and a popular member of the local community, picks up a series of odd jobs to buy the perfect present for his Aunt Lucy's 100th birthday, only for the gift to be stolen."
430,"A boy stands on a station platform as a train is about to leave. Should he go with his mother or stay with his father? Infinite possibilities arise from this decision. As long as he doesn't choose, anything is possible."
431,A young linguist named Milo Thatch joins an intrepid group of explorers to find the mysterious lost continent of Atlantis.
432,"After wishing to be made big, a teenage boy wakes the next morning to find himself mysteriously in the body of an adult."
433,"A video game villain wants to be a hero and sets out to fulfill his dream, but his quest brings havoc to the whole arcade where he lives."
434,The hot-headed young D'Artagnan along with three former legendary but now down-on-their-luck Musketeers must unite and defeat a beautiful double agent and her villainous employer from seizing the French throne and engulfing Europe in war.
435,A dark fairy tale about a gang of five children trying to survive the horrific violence of the cartels and the ghosts created every day by the drug war.
436,Egyptian Prince Moses learns of his identity as a Hebrew and his destiny to become the chosen deliverer of his people.
437,"In a realm known as Kumandra, a re-imagined Earth inhabited by an ancient civilization, a warrior named Raya is determined to find the last dragon."
438,"Determined to make her own path in life, Princess Merida defies a custom that brings chaos to her kingdom. Granted one wish, Merida must rely on her bravery and her archery skills to undo a beastly curse."
439,"A young Peruvian bear travels to London in search of a home. Finding himself lost and alone at Paddington Station, he meets the kindly Brown family, who offer him a temporary haven."
440,"Follows the adventures of Aang, a young successor to a long line of Avatars, who must master all four elements and stop the Fire Nation from enslaving the Water Tribes and the Earth Kingdom."
441,"Five friends set sail and their yacht is overturned by a strange and sudden storm. A mysterious ship arrives to rescue them, and what happens next cannot be explained."
442,Based on Disneyland's theme park ride where a small riverboat takes a group of travelers through a jungle filled with dangerous animals and reptiles but with a supernatural element.
443,A governess uses magic to rein in the behavior of seven ne'er-do-well children in her charge.
444,"After a threat from the tiger Shere Khan forces him to flee the jungle, a man-cub named Mowgli embarks on a journey of self discovery with the help of panther Bagheera and free-spirited bear Baloo."
445,"When a cartoon rabbit is accused of murder, he enlists the help of a burnt out private investigator to prove his innocence."
446,A grumpy Grinch plots to ruin Christmas for the village of Whoville.
447,"Emperor Kuzco is turned into a llama by his ex-administrator Yzma, and must now regain his throne with the help of Pacha, the gentle llama herder."
448,A sausage strives to discover the truth about his existence.
449,The teenage son of the king and queen of Auradon offers the trouble-making children of villains a chance to attend prep school in the kingdom.
450,A space colony family struggles to survive when a spy/accidental stowaway throws their ship hopelessly off course.
451,"Following a ghost invasion of Manhattan, paranormal enthusiasts Erin Gilbert and Abby Yates, nuclear engineer Jillian Holtzmann, and subway worker Patty Tolan band together to stop the otherworldly threat."
452,"A few decades after her original visit, Mary Poppins, the magical nanny, returns to help the Banks siblings and Michael's children through a difficult time in their lives."
453,A young farmer is chosen to undertake a perilous journey in order to protect a special baby from an evil queen.
454,"In 43 AD, the Roman Army returns to crush the Celtic heart of Britannia."
455,"Jean-Baptiste Grenouille, born with a superior olfactory sense, creates the world's finest perfume. His work, however, takes a dark turn as he searches for the ultimate scent."
456,"Dorothy, saved from a psychiatric experiment by a mysterious girl, is somehow called back to Oz when a vain witch and the Nome King destroy everything that makes the magical land beautiful."
457,"A demon raised from infancy after being conjured by and rescued from the Nazis, grows up to become a defender against the forces of darkness."
458,A young Chinese warrior steals a sword from a famed swordsman and then escapes into a world of romantic adventure with a mysterious man in the frontier of the nation.
459,"Ella is under a spell to be constantly obedient, a fact she must hide from her new stepfamily in order to protect the prince of the land, her friend for whom she's falling."
460,"In a corrupt, greed-fueled world, a powerful alchemist leads a messianic character and seven materialistic figures to the Holy Mountain, where they hope to achieve enlightenment."
461,"When Jacob (Asa Butterfield) discovers clues to a mystery that stretches across time, he finds Miss Peregrine's Home for Peculiar Children. But the danger deepens after he gets to know the residents and learns about their special powers."
